1550703431.759307 IP6 (hlim 1, next-header Options (0) payload length: 36) fe80::200:ff:fe00:5 > ff02::16: HBH (rtalert: 0x0000) (padn) [icmp6 sum ok] ICMP6, multicast listener report v2, 1 group record(s) [gaddr ff02::1:ff00:5 to_ex, 0 source(s)]
1550703431.827689 IP6 (flowlabel 0x570a1, hlim 255, next-header UDP (17) payload length: 158) fe80::ca1:4eff:fe92:a6a6.5353 > ff02::fb.5353: [bad udp cksum 0x0008 -> 0x6e22!] 0*- [0q] 2/0/0 6.a.6.a.2.9.e.f.f.f.e.4.1.a.c.0.0.0.0.0.0.0.0.0.0.0.0.0.0.8.e.f.ip6.arpa. (Cache flush) PTR gabriel-VirtualBox.local., gabriel-VirtualBox.local. (Cache flush) AAAA fe80::ca1:4eff:fe92:a6a6 (150)
1550703432.074837 IP6 (flowlabel 0xee175, hlim 255, next-header UDP (17) payload length: 53) fe80::20bc:1eff:fe69:d00a.5353 > ff02::fb.5353: [udp sum ok] 0 [2q] PTR (QM)? _ipps._tcp.local. PTR (QM)? _ipp._tcp.local. (45)
1550703432.635822 IP6 (flowlabel 0x6117b, hlim 255, next-header UDP (17) payload length: 53) fe80::fcca:c0ff:fe83:6e48.5353 > ff02::fb.5353: [udp sum ok] 0 [2q] PTR (QM)? _ipps._tcp.local. PTR (QM)? _ipp._tcp.local. (45)
1550703432.767249 IP6 (flowlabel 0x570a1, hlim 255, next-header UDP (17) payload length: 53) fe80::ca1:4eff:fe92:a6a6.5353 > ff02::fb.5353: [bad udp cksum 0xff9e -> 0xd4de!] 0 [2q] PTR (QM)? _ipps._tcp.local. PTR (QM)? _ipp._tcp.local. (45)
1550703433.334342 IP6 (flowlabel 0xee175, hlim 255, next-header UDP (17) payload length: 158) fe80::20bc:1eff:fe69:d00a.5353 > ff02::fb.5353: [udp sum ok] 0*- [0q] 2/0/0 a.0.0.d.9.6.e.f.f.f.e.1.c.b.0.2.0.0.0.0.0.0.0.0.0.0.0.0.0.8.e.f.ip6.arpa. (Cache flush) PTR gabriel-VirtualBox.local., gabriel-VirtualBox.local. (Cache flush) AAAA fe80::20bc:1eff:fe69:d00a (150)
1550703433.412116 IP6 (hlim 255, next-header ICMPv6 (58) payload length: 16) fe80::20bc:1eff:fe69:d00a > ff02::2: [icmp6 sum ok] ICMP6, router solicitation, length 16
	  source link-address option (1), length 8 (1): 22:bc:1e:69:d0:0a
1550703433.663491 IP6 (hlim 255, next-header ICMPv6 (58) payload length: 16) fe80::fcca:c0ff:fe83:6e48 > ff02::2: [icmp6 sum ok] ICMP6, router solicitation, length 16
	  source link-address option (1), length 8 (1): fe:ca:c0:83:6e:48
1550703433.899537 IP6 (flowlabel 0x6117b, hlim 255, next-header UDP (17) payload length: 158) fe80::fcca:c0ff:fe83:6e48.5353 > ff02::fb.5353: [udp sum ok] 0*- [0q] 2/0/0 8.4.e.6.3.8.e.f.f.f.0.c.a.c.c.f.0.0.0.0.0.0.0.0.0.0.0.0.0.8.e.f.ip6.arpa. (Cache flush) PTR gabriel-VirtualBox.local., gabriel-VirtualBox.local. (Cache flush) AAAA fe80::fcca:c0ff:fe83:6e48 (150)
1550703433.920510 IP6 (hlim 255, next-header ICMPv6 (58) payload length: 16) fe80::ca1:4eff:fe92:a6a6 > ff02::2: [icmp6 sum ok] ICMP6, router solicitation, length 16
	  source link-address option (1), length 8 (1): 0e:a1:4e:92:a6:a6
1550703434.036058 IP6 (flowlabel 0x570a1, hlim 255, next-header UDP (17) payload length: 158) fe80::ca1:4eff:fe92:a6a6.5353 > ff02::fb.5353: [bad udp cksum 0x0008 -> 0x6e22!] 0*- [0q] 2/0/0 6.a.6.a.2.9.e.f.f.f.e.4.1.a.c.0.0.0.0.0.0.0.0.0.0.0.0.0.0.8.e.f.ip6.arpa. (Cache flush) PTR gabriel-VirtualBox.local., gabriel-VirtualBox.local. (Cache flush) AAAA fe80::ca1:4eff:fe92:a6a6 (150)
1550703434.428443 IP6 (hlim 255, next-header ICMPv6 (58) payload length: 16) fe80::200:ff:fe00:2 > ff02::2: [icmp6 sum ok] ICMP6, router solicitation, length 16
	  source link-address option (1), length 8 (1): 00:00:00:00:00:02
1550703434.456455 IP6 (hlim 255, next-header ICMPv6 (58) payload length: 16) fe80::200:ff:fe00:1 > ff02::2: [icmp6 sum ok] ICMP6, router solicitation, length 16
	  source link-address option (1), length 8 (1): 00:00:00:00:00:01
1550703434.697071 IP6 (hlim 255, next-header ICMPv6 (58) payload length: 16) fe80::200:ff:fe00:3 > ff02::2: [icmp6 sum ok] ICMP6, router solicitation, length 16
	  source link-address option (1), length 8 (1): 00:00:00:00:00:03
1550703435.218406 IP6 (hlim 255, next-header ICMPv6 (58) payload length: 16) fe80::200:ff:fe00:5 > ff02::2: [icmp6 sum ok] ICMP6, router solicitation, length 16
	  source link-address option (1), length 8 (1): 00:00:00:00:00:05
1550703435.220183 IP6 (hlim 255, next-header ICMPv6 (58) payload length: 16) fe80::200:ff:fe00:6 > ff02::2: [icmp6 sum ok] ICMP6, router solicitation, length 16
	  source link-address option (1), length 8 (1): 00:00:00:00:00:06
1550703435.478979 IP6 (hlim 255, next-header ICMPv6 (58) payload length: 16) fe80::200:ff:fe00:4 > ff02::2: [icmp6 sum ok] ICMP6, router solicitation, length 16
	  source link-address option (1), length 8 (1): 00:00:00:00:00:04
1550703435.913425 ARP, Ethernet (len 6), IPv4 (len 4), Request who-has 10.0.0.2 tell 10.0.0.5, length 28
1550703435.915153 ARP, Ethernet (len 6), IPv4 (len 4), Reply 10.0.0.2 is-at 00:00:00:00:00:02, length 28
1550703435.956081 IP (tos 0x0, ttl 64, id 26565, offset 0, flags [DF], proto TCP (6), length 60)
    10.0.0.5.53968 > 10.0.0.2.8000: Flags [S], cksum 0xa0ad (correct), seq 3683025256, win 29200, options [mss 1460,sackOK,TS val 886021481 ecr 0,nop,wscale 10], length 0
1550703435.957405 IP (tos 0x0, ttl 64, id 0, offset 0, flags [DF], proto TCP (6), length 60)
    10.0.0.2.8000 > 10.0.0.5.53968: Flags [S.], cksum 0x1435 (incorrect -> 0xf7fa), seq 2740791000, ack 3683025257, win 28960, options [mss 1460,sackOK,TS val 3046255049 ecr 886021481,nop,wscale 10], length 0
1550703435.990403 IP (tos 0x0, ttl 64, id 26566, offset 0, flags [DF], proto TCP (6), length 52)
    10.0.0.5.53968 > 10.0.0.2.8000: Flags [.], cksum 0x976f (correct), ack 1, win 29, options [nop,nop,TS val 886021575 ecr 3046255049], length 0
1550703436.022851 IP (tos 0x0, ttl 64, id 26567, offset 0, flags [DF], proto TCP (6), length 230)
    10.0.0.5.53968 > 10.0.0.2.8000: Flags [P.], cksum 0x14df (incorrect -> 0x1de9), seq 1:179, ack 1, win 29, options [nop,nop,TS val 886021608 ecr 3046255049], length 178
1550703436.024191 IP (tos 0x0, ttl 64, id 49182, offset 0, flags [DF], proto TCP (6), length 52)
    10.0.0.2.8000 > 10.0.0.5.53968: Flags [.], cksum 0x142d (incorrect -> 0x9658), ack 179, win 30, options [nop,nop,TS val 3046255116 ecr 886021608], length 0
1550703436.079388 IP6 (flowlabel 0xee175, hlim 255, next-header UDP (17) payload length: 53) fe80::20bc:1eff:fe69:d00a.5353 > ff02::fb.5353: [udp sum ok] 0 [2q] PTR (QM)? _ipps._tcp.local. PTR (QM)? _ipp._tcp.local. (45)
1550703436.639133 IP6 (flowlabel 0x6117b, hlim 255, next-header UDP (17) payload length: 53) fe80::fcca:c0ff:fe83:6e48.5353 > ff02::fb.5353: [udp sum ok] 0 [2q] PTR (QM)? _ipps._tcp.local. PTR (QM)? _ipp._tcp.local. (45)
1550703436.770806 IP6 (flowlabel 0x570a1, hlim 255, next-header UDP (17) payload length: 53) fe80::ca1:4eff:fe92:a6a6.5353 > ff02::fb.5353: [bad udp cksum 0xff9e -> 0xd4de!] 0 [2q] PTR (QM)? _ipps._tcp.local. PTR (QM)? _ipp._tcp.local. (45)
1550703437.058677 IP (tos 0x0, ttl 64, id 49183, offset 0, flags [DF], proto TCP (6), length 2948)
    10.0.0.2.8000 > 10.0.0.5.53968: Flags [.], cksum 0x1f7d (incorrect -> 0xaff7), seq 1:2897, ack 179, win 30, options [nop,nop,TS val 3046256150 ecr 886021608], length 2896
1550703437.067298 IP (tos 0x0, ttl 64, id 49185, offset 0, flags [DF], proto TCP (6), length 2948)
    10.0.0.2.8000 > 10.0.0.5.53968: Flags [.], cksum 0x1f7d (incorrect -> 0xac26), seq 2897:5793, ack 179, win 30, options [nop,nop,TS val 3046256150 ecr 886021608], length 2896
1550703437.081979 IP (tos 0x0, ttl 64, id 49187, offset 0, flags [DF], proto TCP (6), length 2948)
    10.0.0.2.8000 > 10.0.0.5.53968: Flags [.], cksum 0x1f7d (incorrect -> 0x3376), seq 5793:8689, ack 179, win 30, options [nop,nop,TS val 3046256150 ecr 886021608], length 2896
1550703437.089052 IP (tos 0x0, ttl 64, id 49189, offset 0, flags [DF], proto TCP (6), length 2948)
    10.0.0.2.8000 > 10.0.0.5.53968: Flags [.], cksum 0x1f7d (incorrect -> 0xd3ae), seq 8689:11585, ack 179, win 30, options [nop,nop,TS val 3046256150 ecr 886021608], length 2896
1550703437.101304 IP (tos 0x0, ttl 64, id 49191, offset 0, flags [DF], proto TCP (6), length 2948)
    10.0.0.2.8000 > 10.0.0.5.53968: Flags [.], cksum 0x1f7d (incorrect -> 0xd408), seq 11585:14481, ack 179, win 30, options [nop,nop,TS val 3046256150 ecr 886021608], length 2896
1550703437.138886 IP (tos 0x0, ttl 64, id 49193, offset 0, flags [DF], proto TCP (6), length 1500)
    10.0.0.2.8000 > 10.0.0.5.53968: Flags [.], cksum 0x19d5 (incorrect -> 0xcbd4), seq 14481:15929, ack 179, win 30, options [nop,nop,TS val 3046256230 ecr 886021608], length 1448
1550703437.151063 IP (tos 0x0, ttl 64, id 26568, offset 0, flags [DF], proto TCP (6), length 52)
    10.0.0.5.53968 > 10.0.0.2.8000: Flags [.], cksum 0x142d (incorrect -> 0x82ca), ack 2897, win 35, options [nop,nop,TS val 886022679 ecr 3046256150], length 0
1550703437.155662 IP (tos 0x0, ttl 64, id 49194, offset 0, flags [DF], proto TCP (6), length 2948)
    10.0.0.2.8000 > 10.0.0.5.53968: Flags [.], cksum 0x1f7d (incorrect -> 0x13dc), seq 15929:18825, ack 179, win 30, options [nop,nop,TS val 3046256244 ecr 886022679], length 2896
1550703437.161332 IP (tos 0x0, ttl 64, id 26569, offset 0, flags [DF], proto TCP (6), length 52)
    10.0.0.5.53968 > 10.0.0.2.8000: Flags [.], cksum 0x142d (incorrect -> 0x7734), ack 5793, win 40, options [nop,nop,TS val 886022744 ecr 3046256150], length 0
1550703437.163012 IP (tos 0x0, ttl 64, id 49196, offset 0, flags [DF], proto TCP (6), length 2948)
    10.0.0.2.8000 > 10.0.0.5.53968: Flags [.], cksum 0x1f7d (incorrect -> 0xc833), seq 18825:21721, ack 179, win 30, options [nop,nop,TS val 3046256254 ecr 886022744], length 2896
1550703437.181495 IP (tos 0x0, ttl 64, id 49198, offset 0, flags [DF], proto TCP (6), length 2948)
    10.0.0.2.8000 > 10.0.0.5.53968: Flags [.], cksum 0x1f7d (incorrect -> 0x727f), seq 21721:24617, ack 179, win 30, options [nop,nop,TS val 3046256254 ecr 886022744], length 2896
1550703437.305592 IP (tos 0x0, ttl 64, id 26570, offset 0, flags [DF], proto TCP (6), length 52)
    10.0.0.5.53968 > 10.0.0.2.8000: Flags [.], cksum 0x142d (incorrect -> 0x6b55), ack 8689, win 46, options [nop,nop,TS val 886022881 ecr 3046256150], length 0
1550703437.307286 IP (tos 0x0, ttl 64, id 49200, offset 0, flags [DF], proto TCP (6), length 2948)
    10.0.0.2.8000 > 10.0.0.5.53968: Flags [.], cksum 0x1f7d (incorrect -> 0xeae1), seq 24617:27513, ack 179, win 30, options [nop,nop,TS val 3046256398 ecr 886022881], length 2896
1550703437.314479 IP (tos 0x0, ttl 64, id 49202, offset 0, flags [DF], proto TCP (6), length 1500)
    10.0.0.2.8000 > 10.0.0.5.53968: Flags [P.], cksum 0x19d5 (incorrect -> 0x61cc), seq 27513:28961, ack 179, win 30, options [nop,nop,TS val 3046256398 ecr 886022881], length 1448
1550703437.333969 IP (tos 0x0, ttl 64, id 49203, offset 0, flags [DF], proto TCP (6), length 2948)
    10.0.0.2.8000 > 10.0.0.5.53968: Flags [.], cksum 0x1f7d (incorrect -> 0x8bf0), seq 28961:31857, ack 179, win 30, options [nop,nop,TS val 3046256398 ecr 886022881], length 2896
1550703437.426924 IP (tos 0x0, ttl 64, id 26571, offset 0, flags [DF], proto TCP (6), length 52)
    10.0.0.5.53968 > 10.0.0.2.8000: Flags [.], cksum 0x142d (incorrect -> 0x5f99), ack 11585, win 52, options [nop,nop,TS val 886022983 ecr 3046256150], length 0
1550703437.428855 IP (tos 0x0, ttl 64, id 49205, offset 0, flags [DF], proto TCP (6), length 2948)
    10.0.0.2.8000 > 10.0.0.5.53968: Flags [.], cksum 0x1f7d (incorrect -> 0x1fef), seq 31857:34753, ack 179, win 30, options [nop,nop,TS val 3046256520 ecr 886022983], length 2896
1550703437.436478 IP (tos 0x0, ttl 64, id 49207, offset 0, flags [DF], proto TCP (6), length 2948)
    10.0.0.2.8000 > 10.0.0.5.53968: Flags [.], cksum 0x1f7d (incorrect -> 0x2e33), seq 34753:37649, ack 179, win 30, options [nop,nop,TS val 3046256520 ecr 886022983], length 2896
1550703437.541355 IP (tos 0x0, ttl 64, id 26572, offset 0, flags [DF], proto TCP (6), length 52)
    10.0.0.5.53968 > 10.0.0.2.8000: Flags [.], cksum 0x142d (incorrect -> 0x53ca), ack 14481, win 57, options [nop,nop,TS val 886023105 ecr 3046256150], length 0
1550703437.543290 IP (tos 0x0, ttl 64, id 49209, offset 0, flags [DF], proto TCP (6), length 2948)
    10.0.0.2.8000 > 10.0.0.5.53968: Flags [.], cksum 0x1f7d (incorrect -> 0x49df), seq 37649:40545, ack 179, win 30, options [nop,nop,TS val 3046256634 ecr 886023105], length 2896
1550703437.549405 IP (tos 0x0, ttl 64, id 49211, offset 0, flags [DF], proto TCP (6), length 2948)
    10.0.0.2.8000 > 10.0.0.5.53968: Flags [P.], cksum 0x1f7d (incorrect -> 0x7db9), seq 40545:43441, ack 179, win 30, options [nop,nop,TS val 3046256634 ecr 886023105], length 2896
1550703437.635012 IP (tos 0x0, ttl 64, id 26573, offset 0, flags [DF], proto TCP (6), length 52)
    10.0.0.5.53968 > 10.0.0.2.8000: Flags [.], cksum 0x142d (incorrect -> 0x4d5b), ack 15929, win 60, options [nop,nop,TS val 886023221 ecr 3046256230], length 0
1550703437.636908 IP (tos 0x0, ttl 64, id 49213, offset 0, flags [DF], proto TCP (6), length 2948)
    10.0.0.2.8000 > 10.0.0.5.53968: Flags [.], cksum 0x1f7d (incorrect -> 0xa15b), seq 43441:46337, ack 179, win 30, options [nop,nop,TS val 3046256728 ecr 886023221], length 2896
1550703437.720992 IP (tos 0x0, ttl 64, id 26574, offset 0, flags [DF], proto TCP (6), length 52)
    10.0.0.5.53968 > 10.0.0.2.8000: Flags [.], cksum 0x142d (incorrect -> 0x41b9), ack 18825, win 66, options [nop,nop,TS val 886023283 ecr 3046256244], length 0
1550703437.723508 IP (tos 0x0, ttl 64, id 49215, offset 0, flags [DF], proto TCP (6), length 2948)
    10.0.0.2.8000 > 10.0.0.5.53968: Flags [.], cksum 0x1f7d (incorrect -> 0x405c), seq 46337:49233, ack 179, win 30, options [nop,nop,TS val 3046256814 ecr 886023283], length 2896
1550703437.732497 IP (tos 0x0, ttl 64, id 49217, offset 0, flags [DF], proto TCP (6), length 2948)
    10.0.0.2.8000 > 10.0.0.5.53968: Flags [.], cksum 0x1f7d (incorrect -> 0x9e72), seq 49233:52129, ack 179, win 30, options [nop,nop,TS val 3046256814 ecr 886023283], length 2896
1550703437.833200 IP (tos 0x0, ttl 64, id 26575, offset 0, flags [DF], proto TCP (6), length 52)
    10.0.0.5.53968 > 10.0.0.2.8000: Flags [.], cksum 0x142d (incorrect -> 0x35e2), ack 21721, win 71, options [nop,nop,TS val 886023403 ecr 3046256254], length 0
1550703437.835158 IP (tos 0x0, ttl 64, id 49219, offset 0, flags [DF], proto TCP (6), length 2948)
    10.0.0.2.8000 > 10.0.0.5.53968: Flags [.], cksum 0x1f7d (incorrect -> 0x800e), seq 52129:55025, ack 179, win 30, options [nop,nop,TS val 3046256926 ecr 886023403], length 2896
1550703437.842211 IP (tos 0x0, ttl 64, id 49221, offset 0, flags [DF], proto TCP (6), length 2948)
    10.0.0.2.8000 > 10.0.0.5.53968: Flags [.], cksum 0x1f7d (incorrect -> 0x126a), seq 55025:57921, ack 179, win 30, options [nop,nop,TS val 3046256926 ecr 886023403], length 2896
1550703437.940028 IP (tos 0x0, ttl 64, id 26576, offset 0, flags [DF], proto TCP (6), length 52)
    10.0.0.5.53968 > 10.0.0.2.8000: Flags [.], cksum 0x142d (incorrect -> 0x2a12), ack 24617, win 77, options [nop,nop,TS val 886023525 ecr 3046256254], length 0
1550703437.942547 IP (tos 0x0, ttl 64, id 49223, offset 0, flags [DF], proto TCP (6), length 2948)
    10.0.0.2.8000 > 10.0.0.5.53968: Flags [.], cksum 0x1f7d (incorrect -> 0xf48c), seq 57921:60817, ack 179, win 30, options [nop,nop,TS val 3046257033 ecr 886023525], length 2896
1550703437.949060 IP (tos 0x0, ttl 64, id 49225, offset 0, flags [DF], proto TCP (6), length 2948)
    10.0.0.2.8000 > 10.0.0.5.53968: Flags [.], cksum 0x1f7d (incorrect -> 0x0dd8), seq 60817:63713, ack 179, win 30, options [nop,nop,TS val 3046257033 ecr 886023525], length 2896
1550703438.093057 IP (tos 0x0, ttl 64, id 26577, offset 0, flags [DF], proto TCP (6), length 52)
    10.0.0.5.53968 > 10.0.0.2.8000: Flags [.], cksum 0x142d (incorrect -> 0x1d94), ack 27513, win 83, options [nop,nop,TS val 886023677 ecr 3046256398], length 0
1550703438.094773 IP (tos 0x0, ttl 64, id 49227, offset 0, flags [DF], proto TCP (6), length 2948)
    10.0.0.2.8000 > 10.0.0.5.53968: Flags [.], cksum 0x1f7d (incorrect -> 0x5dc3), seq 63713:66609, ack 179, win 30, options [nop,nop,TS val 3046257186 ecr 886023677], length 2896
1550703438.104481 IP (tos 0x0, ttl 64, id 49229, offset 0, flags [DF], proto TCP (6), length 2948)
    10.0.0.2.8000 > 10.0.0.5.53968: Flags [.], cksum 0x1f7d (incorrect -> 0xdeba), seq 66609:69505, ack 179, win 30, options [nop,nop,TS val 3046257186 ecr 886023677], length 2896
1550703438.194044 IP (tos 0x0, ttl 64, id 26578, offset 0, flags [DF], proto TCP (6), length 52)
    10.0.0.5.53968 > 10.0.0.2.8000: Flags [.], cksum 0x142d (incorrect -> 0x1785), ack 28961, win 86, options [nop,nop,TS val 886023777 ecr 3046256398], length 0
1550703438.195343 IP (tos 0x0, ttl 64, id 49231, offset 0, flags [DF], proto TCP (6), length 2948)
    10.0.0.2.8000 > 10.0.0.5.53968: Flags [P.], cksum 0x1f7d (incorrect -> 0xfff7), seq 69505:72401, ack 179, win 30, options [nop,nop,TS val 3046257287 ecr 886023777], length 2896
1550703438.240766 IP (tos 0x0, ttl 64, id 26579, offset 0, flags [DF], proto TCP (6), length 52)
    10.0.0.5.53968 > 10.0.0.2.8000: Flags [.], cksum 0x142d (incorrect -> 0x0bfe), ack 31857, win 91, options [nop,nop,TS val 886023827 ecr 3046256398], length 0
1550703438.242326 IP (tos 0x0, ttl 64, id 49233, offset 0, flags [DF], proto TCP (6), length 2948)
    10.0.0.2.8000 > 10.0.0.5.53968: Flags [.], cksum 0x1f7d (incorrect -> 0x3e55), seq 72401:75297, ack 179, win 30, options [nop,nop,TS val 3046257334 ecr 886023827], length 2896
1550703438.249531 IP (tos 0x0, ttl 64, id 49235, offset 0, flags [DF], proto TCP (6), length 2948)
    10.0.0.2.8000 > 10.0.0.5.53968: Flags [.], cksum 0x1f7d (incorrect -> 0xacbd), seq 75297:78193, ack 179, win 30, options [nop,nop,TS val 3046257334 ecr 886023827], length 2896
1550703438.379658 IP (tos 0x0, ttl 64, id 26580, offset 0, flags [DF], proto TCP (6), length 52)
    10.0.0.5.53968 > 10.0.0.2.8000: Flags [.], cksum 0x142d (incorrect -> 0xffb4), ack 34753, win 97, options [nop,nop,TS val 886023948 ecr 3046256520], length 0
1550703438.381670 IP (tos 0x0, ttl 64, id 49237, offset 0, flags [DF], proto TCP (6), length 2948)
    10.0.0.2.8000 > 10.0.0.5.53968: Flags [.], cksum 0x1f7d (incorrect -> 0x6a3b), seq 78193:81089, ack 179, win 30, options [nop,nop,TS val 3046257472 ecr 886023948], length 2896
1550703438.389724 IP (tos 0x0, ttl 64, id 49239, offset 0, flags [DF], proto TCP (6), length 2948)
    10.0.0.2.8000 > 10.0.0.5.53968: Flags [.], cksum 0x1f7d (incorrect -> 0x7125), seq 81089:83985, ack 179, win 30, options [nop,nop,TS val 3046257472 ecr 886023948], length 2896
1550703438.498937 IP (tos 0x0, ttl 64, id 26581, offset 0, flags [DF], proto TCP (6), length 52)
    10.0.0.5.53968 > 10.0.0.2.8000: Flags [.], cksum 0x142d (incorrect -> 0xf3d5), ack 37649, win 103, options [nop,nop,TS val 886024085 ecr 3046256520], length 0
1550703438.501046 IP (tos 0x0, ttl 64, id 49241, offset 0, flags [DF], proto TCP (6), length 2948)
    10.0.0.2.8000 > 10.0.0.5.53968: Flags [.], cksum 0x1f7d (incorrect -> 0x50cf), seq 83985:86881, ack 179, win 30, options [nop,nop,TS val 3046257592 ecr 886024085], length 2896
1550703438.507158 IP (tos 0x0, ttl 64, id 49243, offset 0, flags [DF], proto TCP (6), length 2948)
    10.0.0.2.8000 > 10.0.0.5.53968: Flags [.], cksum 0x1f7d (incorrect -> 0x63ee), seq 86881:89777, ack 179, win 30, options [nop,nop,TS val 3046257592 ecr 886024085], length 2896
1550703438.609254 IP (tos 0x0, ttl 64, id 26582, offset 0, flags [DF], proto TCP (6), length 52)
    10.0.0.5.53968 > 10.0.0.2.8000: Flags [.], cksum 0x142d (incorrect -> 0xe7a0), ack 40545, win 108, options [nop,nop,TS val 886024195 ecr 3046256634], length 0
1550703438.611173 IP (tos 0x0, ttl 64, id 49245, offset 0, flags [DF], proto TCP (6), length 2948)
    10.0.0.2.8000 > 10.0.0.5.53968: Flags [.], cksum 0x1f7d (incorrect -> 0x3656), seq 89777:92673, ack 179, win 30, options [nop,nop,TS val 3046257702 ecr 886024195], length 2896
1550703438.619536 IP (tos 0x0, ttl 64, id 49247, offset 0, flags [DF], proto TCP (6), length 2948)
    10.0.0.2.8000 > 10.0.0.5.53968: Flags [.], cksum 0x1f7d (incorrect -> 0xd131), seq 92673:95569, ack 179, win 30, options [nop,nop,TS val 3046257702 ecr 886024195], length 2896
1550703438.747145 IP (tos 0x0, ttl 64, id 26583, offset 0, flags [DF], proto TCP (6), length 52)
    10.0.0.5.53968 > 10.0.0.2.8000: Flags [.], cksum 0x142d (incorrect -> 0xdbc1), ack 43441, win 114, options [nop,nop,TS val 886024332 ecr 3046256634], length 0
1550703438.749363 IP (tos 0x0, ttl 64, id 49249, offset 0, flags [DF], proto TCP (6), length 2948)
    10.0.0.2.8000 > 10.0.0.5.53968: Flags [.], cksum 0x1f7d (incorrect -> 0xffaa), seq 95569:98465, ack 179, win 30, options [nop,nop,TS val 3046257840 ecr 886024332], length 2896
1550703438.851020 IP (tos 0x0, ttl 64, id 26584, offset 0, flags [DF], proto TCP (6), length 52)
    10.0.0.5.53968 > 10.0.0.2.8000: Flags [.], cksum 0x142d (incorrect -> 0xcfa7), ack 46337, win 120, options [nop,nop,TS val 886024434 ecr 3046256728], length 0
1550703438.852542 IP (tos 0x0, ttl 64, id 49251, offset 0, flags [DF], proto TCP (6), length 2948)
    10.0.0.2.8000 > 10.0.0.5.53968: Flags [.], cksum 0x1f7d (incorrect -> 0x6f16), seq 98465:101361, ack 179, win 30, options [nop,nop,TS val 3046257944 ecr 886024434], length 2896
1550703438.980516 IP (tos 0x0, ttl 64, id 26585, offset 0, flags [DF], proto TCP (6), length 52)
    10.0.0.5.53968 > 10.0.0.2.8000: Flags [.], cksum 0x142d (incorrect -> 0xc383), ack 49233, win 125, options [nop,nop,TS val 886024555 ecr 3046256814], length 0
1550703438.982831 IP (tos 0x0, ttl 64, id 49253, offset 0, flags [DF], proto TCP (6), length 2948)
    10.0.0.2.8000 > 10.0.0.5.53968: Flags [.], cksum 0x1f7d (incorrect -> 0xc635), seq 101361:104257, ack 179, win 30, options [nop,nop,TS val 3046258073 ecr 886024555], length 2896
1550703439.091862 IP (tos 0x0, ttl 64, id 26586, offset 0, flags [DF], proto TCP (6), length 52)
    10.0.0.5.53968 > 10.0.0.2.8000: Flags [.], cksum 0x142d (incorrect -> 0xb7b4), ack 52129, win 131, options [nop,nop,TS val 886024676 ecr 3046256814], length 0
1550703439.093759 IP (tos 0x0, ttl 64, id 49255, offset 0, flags [DF], proto TCP (6), length 2948)
    10.0.0.2.8000 > 10.0.0.5.53968: Flags [.], cksum 0x1f7d (incorrect -> 0x7e8b), seq 104257:107153, ack 179, win 30, options [nop,nop,TS val 3046258185 ecr 886024676], length 2896
1550703439.222882 IP (tos 0x0, ttl 64, id 26587, offset 0, flags [DF], proto TCP (6), length 52)
    10.0.0.5.53968 > 10.0.0.2.8000: Flags [.], cksum 0x142d (incorrect -> 0xab78), ack 55025, win 136, options [nop,nop,TS val 886024795 ecr 3046256926], length 0
1550703439.231240 IP (tos 0x0, ttl 64, id 49257, offset 0, flags [DF], proto TCP (6), length 2948)
    10.0.0.2.8000 > 10.0.0.5.53968: Flags [.], cksum 0x1f7d (incorrect -> 0x8c71), seq 107153:110049, ack 179, win 30, options [nop,nop,TS val 3046258316 ecr 886024795], length 2896
1550703439.339932 IP (tos 0x0, ttl 64, id 26588, offset 0, flags [DF], proto TCP (6), length 52)
    10.0.0.5.53968 > 10.0.0.2.8000: Flags [.], cksum 0x142d (incorrect -> 0x9fa8), ack 57921, win 142, options [nop,nop,TS val 886024917 ecr 3046256926], length 0
1550703439.341539 IP (tos 0x0, ttl 64, id 49259, offset 0, flags [DF], proto TCP (6), length 2948)
    10.0.0.2.8000 > 10.0.0.5.53968: Flags [.], cksum 0x1f7d (incorrect -> 0x27e9), seq 110049:112945, ack 179, win 30, options [nop,nop,TS val 3046258433 ecr 886024917], length 2896
1550703439.452296 IP (tos 0x0, ttl 64, id 26589, offset 0, flags [DF], proto TCP (6), length 52)
    10.0.0.5.53968 > 10.0.0.2.8000: Flags [.], cksum 0x142d (incorrect -> 0x936d), ack 60817, win 148, options [nop,nop,TS val 886025039 ecr 3046257033], length 0
1550703439.453814 IP (tos 0x0, ttl 64, id 49261, offset 0, flags [DF], proto TCP (6), length 1500)
    10.0.0.2.8000 > 10.0.0.5.53968: Flags [.], cksum 0x19d5 (incorrect -> 0x2f3f), seq 112945:114393, ack 179, win 30, options [nop,nop,TS val 3046258545 ecr 886025039], length 1448
1550703439.453820 IP (tos 0x0, ttl 64, id 49262, offset 0, flags [DF], proto TCP (6), length 1500)
    10.0.0.2.8000 > 10.0.0.5.53968: Flags [.], cksum 0x19d5 (incorrect -> 0xac84), seq 114393:115841, ack 179, win 30, options [nop,nop,TS val 3046258546 ecr 886025039], length 1448
1550703439.577324 IP (tos 0x0, ttl 64, id 26590, offset 0, flags [DF], proto TCP (6), length 52)
    10.0.0.5.53968 > 10.0.0.2.8000: Flags [.], cksum 0x142d (incorrect -> 0x87a0), ack 63713, win 153, options [nop,nop,TS val 886025159 ecr 3046257033], length 0
1550703439.579335 IP (tos 0x0, ttl 64, id 49263, offset 0, flags [DF], proto TCP (6), length 2948)
    10.0.0.2.8000 > 10.0.0.5.53968: Flags [.], cksum 0x1f7d (incorrect -> 0x2f30), seq 115841:118737, ack 179, win 30, options [nop,nop,TS val 3046258670 ecr 886025159], length 2896
1550703439.694221 IP (tos 0x0, ttl 64, id 26591, offset 0, flags [DF], proto TCP (6), length 52)
    10.0.0.5.53968 > 10.0.0.2.8000: Flags [.], cksum 0x142d (incorrect -> 0x7b38), ack 66609, win 159, options [nop,nop,TS val 886025280 ecr 3046257186], length 0
1550703439.696449 IP (tos 0x0, ttl 64, id 49265, offset 0, flags [DF], proto TCP (6), length 2948)
    10.0.0.2.8000 > 10.0.0.5.53968: Flags [.], cksum 0x1f7d (incorrect -> 0xc252), seq 118737:121633, ack 179, win 30, options [nop,nop,TS val 3046258787 ecr 886025280], length 2896
1550703439.818224 IP (tos 0x0, ttl 64, id 26592, offset 0, flags [DF], proto TCP (6), length 52)
    10.0.0.5.53968 > 10.0.0.2.8000: Flags [.], cksum 0x142d (incorrect -> 0x6f67), ack 69505, win 165, options [nop,nop,TS val 886025403 ecr 3046257186], length 0
1550703439.820220 IP (tos 0x0, ttl 64, id 49267, offset 0, flags [DF], proto TCP (6), length 2948)
    10.0.0.2.8000 > 10.0.0.5.53968: Flags [.], cksum 0x1f7d (incorrect -> 0x34e5), seq 121633:124529, ack 179, win 30, options [nop,nop,TS val 3046258911 ecr 886025403], length 2896
1550703439.936717 IP (tos 0x0, ttl 64, id 26593, offset 0, flags [DF], proto TCP (6), length 52)
    10.0.0.5.53968 > 10.0.0.2.8000: Flags [.], cksum 0x142d (incorrect -> 0x6335), ack 72401, win 170, options [nop,nop,TS val 886025523 ecr 3046257287], length 0
1550703439.938433 IP (tos 0x0, ttl 64, id 49269, offset 0, flags [DF], proto TCP (6), length 2948)
    10.0.0.2.8000 > 10.0.0.5.53968: Flags [.], cksum 0x1f7d (incorrect -> 0x22ec), seq 124529:127425, ack 179, win 30, options [nop,nop,TS val 3046259029 ecr 886025523], length 2896
1550703440.058255 IP (tos 0x0, ttl 64, id 26594, offset 0, flags [DF], proto TCP (6), length 52)
    10.0.0.5.53968 > 10.0.0.2.8000: Flags [.], cksum 0x142d (incorrect -> 0x5738), ack 75297, win 176, options [nop,nop,TS val 886025643 ecr 3046257334], length 0
1550703440.059542 IP (tos 0x0, ttl 64, id 49271, offset 0, flags [DF], proto TCP (6), length 2948)
    10.0.0.2.8000 > 10.0.0.5.53968: Flags [.], cksum 0x1f7d (incorrect -> 0x869b), seq 127425:130321, ack 179, win 30, options [nop,nop,TS val 3046259151 ecr 886025643], length 2896
1550703440.178697 IP (tos 0x0, ttl 64, id 26595, offset 0, flags [DF], proto TCP (6), length 52)
    10.0.0.5.53968 > 10.0.0.2.8000: Flags [.], cksum 0x142d (incorrect -> 0x4b6a), ack 78193, win 180, options [nop,nop,TS val 886025765 ecr 3046257334], length 0
1550703440.182559 IP (tos 0x0, ttl 64, id 49273, offset 0, flags [DF], proto TCP (6), length 2948)
    10.0.0.2.8000 > 10.0.0.5.53968: Flags [.], cksum 0x1f7d (incorrect -> 0x6f65), seq 130321:133217, ack 179, win 30, options [nop,nop,TS val 3046259271 ecr 886025765], length 2896
1550703440.306720 IP (tos 0x0, ttl 64, id 26596, offset 0, flags [DF], proto TCP (6), length 52)
    10.0.0.5.53968 > 10.0.0.2.8000: Flags [.], cksum 0x142d (incorrect -> 0x3f17), ack 81089, win 180, options [nop,nop,TS val 886025886 ecr 3046257472], length 0
1550703440.308393 IP (tos 0x0, ttl 64, id 49275, offset 0, flags [DF], proto TCP (6), length 2948)
    10.0.0.2.8000 > 10.0.0.5.53968: Flags [.], cksum 0x1f7d (incorrect -> 0xd613), seq 133217:136113, ack 179, win 30, options [nop,nop,TS val 3046259399 ecr 886025886], length 2896
1550703440.420095 IP (tos 0x0, ttl 64, id 26597, offset 0, flags [DF], proto TCP (6), length 52)
    10.0.0.5.53968 > 10.0.0.2.8000: Flags [.], cksum 0x142d (incorrect -> 0x334e), ack 83985, win 180, options [nop,nop,TS val 886026007 ecr 3046257472], length 0
1550703440.421753 IP (tos 0x0, ttl 64, id 49277, offset 0, flags [DF], proto TCP (6), length 2948)
    10.0.0.2.8000 > 10.0.0.5.53968: Flags [.], cksum 0x1f7d (incorrect -> 0xee40), seq 136113:139009, ack 179, win 30, options [nop,nop,TS val 3046259513 ecr 886026007], length 2896
1550703440.541571 IP (tos 0x0, ttl 64, id 26598, offset 0, flags [DF], proto TCP (6), length 52)
    10.0.0.5.53968 > 10.0.0.2.8000: Flags [.], cksum 0x142d (incorrect -> 0x270d), ack 86881, win 180, options [nop,nop,TS val 886026128 ecr 3046257592], length 0
1550703440.543231 IP (tos 0x0, ttl 64, id 49279, offset 0, flags [DF], proto TCP (6), length 2948)
    10.0.0.2.8000 > 10.0.0.5.53968: Flags [.], cksum 0x1f7d (incorrect -> 0xf446), seq 139009:141905, ack 179, win 30, options [nop,nop,TS val 3046259634 ecr 886026128], length 2896
1550703440.666807 IP (tos 0x0, ttl 64, id 26599, offset 0, flags [DF], proto TCP (6), length 52)
    10.0.0.5.53968 > 10.0.0.2.8000: Flags [.], cksum 0x142d (incorrect -> 0x1b40), ack 89777, win 180, options [nop,nop,TS val 886026253 ecr 3046257592], length 0
1550703440.668201 IP (tos 0x0, ttl 64, id 49281, offset 0, flags [DF], proto TCP (6), length 2948)
    10.0.0.2.8000 > 10.0.0.5.53968: Flags [.], cksum 0x1f7d (incorrect -> 0x153b), seq 141905:144801, ack 179, win 30, options [nop,nop,TS val 3046259760 ecr 886026253], length 2896
1550703440.787827 IP (tos 0x0, ttl 64, id 26600, offset 0, flags [DF], proto TCP (6), length 52)
    10.0.0.5.53968 > 10.0.0.2.8000: Flags [.], cksum 0x142d (incorrect -> 0x0f0d), ack 92673, win 180, options [nop,nop,TS val 886026370 ecr 3046257702], length 0
1550703440.790627 IP (tos 0x0, ttl 64, id 49283, offset 0, flags [DF], proto TCP (6), length 2948)
    10.0.0.2.8000 > 10.0.0.5.53968: Flags [.], cksum 0x1f7d (incorrect -> 0xe8dc), seq 144801:147697, ack 179, win 30, options [nop,nop,TS val 3046259881 ecr 886026370], length 2896
1550703440.912780 IP (tos 0x0, ttl 64, id 26601, offset 0, flags [DF], proto TCP (6), length 52)
    10.0.0.5.53968 > 10.0.0.2.8000: Flags [.], cksum 0x142d (incorrect -> 0x0344), ack 95569, win 180, options [nop,nop,TS val 886026491 ecr 3046257702], length 0
1550703440.914596 IP (tos 0x0, ttl 64, id 49285, offset 0, flags [DF], proto TCP (6), length 2948)
    10.0.0.2.8000 > 10.0.0.5.53968: Flags [.], cksum 0x1f7d (incorrect -> 0x0056), seq 147697:150593, ack 179, win 30, options [nop,nop,TS val 3046260006 ecr 886026491], length 2896
1550703440.926232 IP (tos 0x0, ttl 64, id 49287, offset 0, flags [DF], proto TCP (6), length 2948)
    10.0.0.2.8000 > 10.0.0.5.53968: Flags [.], cksum 0x1f7d (incorrect -> 0x6197), seq 150593:153489, ack 179, win 30, options [nop,nop,TS val 3046260006 ecr 886026491], length 2896
1550703441.038253 IP (tos 0x0, ttl 64, id 26602, offset 0, flags [DF], proto TCP (6), length 52)
    10.0.0.5.53968 > 10.0.0.2.8000: Flags [.], cksum 0x142d (incorrect -> 0xf6ef), ack 98465, win 180, options [nop,nop,TS val 886026613 ecr 3046257840], length 0
1550703441.040169 IP (tos 0x0, ttl 64, id 49289, offset 0, flags [DF], proto TCP (6), length 2948)
    10.0.0.2.8000 > 10.0.0.5.53968: Flags [.], cksum 0x1f7d (incorrect -> 0xb9be), seq 153489:156385, ack 179, win 30, options [nop,nop,TS val 3046260131 ecr 886026613], length 2896
1550703441.602323 IP6 (hlim 255, next-header ICMPv6 (58) payload length: 16) fe80::fcca:c0ff:fe83:6e48 > ff02::2: [icmp6 sum ok] ICMP6, router solicitation, length 16
	  source link-address option (1), length 8 (1): fe:ca:c0:83:6e:48
1550703441.876529 IP6 (hlim 255, next-header ICMPv6 (58) payload length: 16) fe80::20bc:1eff:fe69:d00a > ff02::2: [icmp6 sum ok] ICMP6, router solicitation, length 16
	  source link-address option (1), length 8 (1): 22:bc:1e:69:d0:0a
1550703442.366590 IP6 (hlim 255, next-header ICMPv6 (58) payload length: 16) fe80::200:ff:fe00:2 > ff02::2: [icmp6 sum ok] ICMP6, router solicitation, length 16
	  source link-address option (1), length 8 (1): 00:00:00:00:00:02
1550703442.619852 IP6 (hlim 255, next-header ICMPv6 (58) payload length: 16) fe80::ca1:4eff:fe92:a6a6 > ff02::2: [icmp6 sum ok] ICMP6, router solicitation, length 16
	  source link-address option (1), length 8 (1): 0e:a1:4e:92:a6:a6
1550703442.629150 IP6 (hlim 255, next-header ICMPv6 (58) payload length: 16) fe80::200:ff:fe00:1 > ff02::2: [icmp6 sum ok] ICMP6, router solicitation, length 16
	  source link-address option (1), length 8 (1): 00:00:00:00:00:01
1550703442.748376 IP (tos 0x0, ttl 64, id 49291, offset 0, flags [DF], proto TCP (6), length 1500)
    10.0.0.2.8000 > 10.0.0.5.53968: Flags [.], cksum 0x19d5 (incorrect -> 0x154e), seq 156385:157833, ack 179, win 30, options [nop,nop,TS val 3046261839 ecr 886026613], length 1448
1550703442.765639 IP (tos 0x0, ttl 64, id 26603, offset 0, flags [DF], proto TCP (6), length 64)
    10.0.0.5.53968 > 10.0.0.2.8000: Flags [.], cksum 0x1439 (incorrect -> 0x5a34), ack 98465, win 181, options [nop,nop,TS val 886028350 ecr 3046257840,nop,nop,sack 1 {156385:157833}], length 0
1550703442.767018 IP (tos 0x0, ttl 64, id 49292, offset 0, flags [DF], proto TCP (6), length 1500)
    10.0.0.2.8000 > 10.0.0.5.53968: Flags [.], cksum 0x19d5 (incorrect -> 0xac88), seq 98465:99913, ack 179, win 30, options [nop,nop,TS val 3046261858 ecr 886028350], length 1448
1550703442.789507 IP (tos 0x0, ttl 64, id 26604, offset 0, flags [DF], proto TCP (6), length 64)
    10.0.0.5.53968 > 10.0.0.2.8000: Flags [.], cksum 0x1439 (incorrect -> 0x44c6), ack 99913, win 180, options [nop,nop,TS val 886028371 ecr 3046261858,nop,nop,sack 1 {156385:157833}], length 0
1550703442.791248 IP (tos 0x0, ttl 64, id 49293, offset 0, flags [DF], proto TCP (6), length 1500)
    10.0.0.2.8000 > 10.0.0.5.53968: Flags [.], cksum 0x19d5 (incorrect -> 0x7f2d), seq 99913:101361, ack 179, win 30, options [nop,nop,TS val 3046261882 ecr 886028371], length 1448
1550703442.791260 IP (tos 0x0, ttl 64, id 49294, offset 0, flags [DF], proto TCP (6), length 1500)
    10.0.0.2.8000 > 10.0.0.5.53968: Flags [.], cksum 0x19d5 (incorrect -> 0x4c49), seq 101361:102809, ack 179, win 30, options [nop,nop,TS val 3046261882 ecr 886028371], length 1448
1550703442.814369 IP (tos 0x0, ttl 64, id 26605, offset 0, flags [DF], proto TCP (6), length 64)
    10.0.0.5.53968 > 10.0.0.2.8000: Flags [.], cksum 0x1439 (incorrect -> 0x3ee9), ack 101361, win 180, options [nop,nop,TS val 886028400 ecr 3046261882,nop,nop,sack 1 {156385:157833}], length 0
1550703442.815775 IP (tos 0x0, ttl 64, id 49295, offset 0, flags [DF], proto TCP (6), length 1500)
    10.0.0.2.8000 > 10.0.0.5.53968: Flags [.], cksum 0x19d5 (incorrect -> 0x2bd3), seq 102809:104257, ack 179, win 30, options [nop,nop,TS val 3046261907 ecr 886028400], length 1448
1550703442.815781 IP (tos 0x0, ttl 64, id 49296, offset 0, flags [DF], proto TCP (6), length 1500)
    10.0.0.2.8000 > 10.0.0.5.53968: Flags [.], cksum 0x19d5 (incorrect -> 0x3832), seq 104257:105705, ack 179, win 30, options [nop,nop,TS val 3046261907 ecr 886028400], length 1448
1550703442.815784 IP (tos 0x0, ttl 64, id 26606, offset 0, flags [DF], proto TCP (6), length 64)
    10.0.0.5.53968 > 10.0.0.2.8000: Flags [.], cksum 0x1439 (incorrect -> 0x3940), ack 102809, win 179, options [nop,nop,TS val 886028402 ecr 3046261882,nop,nop,sack 1 {156385:157833}], length 0
1550703442.822672 IP (tos 0x0, ttl 64, id 49297, offset 0, flags [DF], proto TCP (6), length 1500)
    10.0.0.2.8000 > 10.0.0.5.53968: Flags [.], cksum 0x19d5 (incorrect -> 0xed9e), seq 105705:107153, ack 179, win 30, options [nop,nop,TS val 3046261909 ecr 886028402], length 1448
1550703442.828380 IP (tos 0x0, ttl 64, id 49298, offset 0, flags [DF], proto TCP (6), length 1500)
    10.0.0.2.8000 > 10.0.0.5.53968: Flags [.], cksum 0x19d5 (incorrect -> 0xb3fe), seq 107153:108601, ack 179, win 30, options [nop,nop,TS val 3046261909 ecr 886028402], length 1448
1550703442.840311 IP (tos 0x0, ttl 64, id 26607, offset 0, flags [DF], proto TCP (6), length 64)
    10.0.0.5.53968 > 10.0.0.2.8000: Flags [.], cksum 0x1439 (incorrect -> 0x336c), ack 104257, win 180, options [nop,nop,TS val 886028420 ecr 3046261907,nop,nop,sack 1 {156385:157833}], length 0
1550703442.842238 IP (tos 0x0, ttl 64, id 49299, offset 0, flags [DF], proto TCP (6), length 1500)
    10.0.0.2.8000 > 10.0.0.5.53968: Flags [.], cksum 0x19d5 (incorrect -> 0x7534), seq 108601:110049, ack 179, win 30, options [nop,nop,TS val 3046261933 ecr 886028420], length 1448
1550703442.842411 IP (tos 0x0, ttl 64, id 49300, offset 0, flags [DF], proto TCP (6), length 1500)
    10.0.0.2.8000 > 10.0.0.5.53968: Flags [.], cksum 0x19d5 (incorrect -> 0xeec3), seq 110049:111497, ack 179, win 30, options [nop,nop,TS val 3046261933 ecr 886028420], length 1448
1550703442.846412 IP (tos 0x0, ttl 64, id 26608, offset 0, flags [DF], proto TCP (6), length 64)
    10.0.0.5.53968 > 10.0.0.2.8000: Flags [.], cksum 0x1439 (incorrect -> 0x2dba), ack 105705, win 180, options [nop,nop,TS val 886028430 ecr 3046261907,nop,nop,sack 1 {156385:157833}], length 0
1550703442.847837 IP (tos 0x0, ttl 64, id 26609, offset 0, flags [DF], proto TCP (6), length 64)
    10.0.0.5.53968 > 10.0.0.2.8000: Flags [.], cksum 0x1439 (incorrect -> 0x280f), ack 107153, win 179, options [nop,nop,TS val 886028432 ecr 3046261909,nop,nop,sack 1 {156385:157833}], length 0
1550703442.848956 IP (tos 0x0, ttl 64, id 49301, offset 0, flags [DF], proto TCP (6), length 1500)
    10.0.0.2.8000 > 10.0.0.5.53968: Flags [.], cksum 0x19d5 (incorrect -> 0xcb4b), seq 111497:112945, ack 179, win 30, options [nop,nop,TS val 3046261939 ecr 886028430], length 1448
1550703442.854878 IP (tos 0x0, ttl 64, id 49302, offset 0, flags [DF], proto TCP (6), length 1500)
    10.0.0.2.8000 > 10.0.0.5.53968: Flags [.], cksum 0x19d5 (incorrect -> 0x14be), seq 112945:114393, ack 179, win 30, options [nop,nop,TS val 3046261939 ecr 886028430], length 1448
1550703442.856596 IP (tos 0x0, ttl 64, id 26610, offset 0, flags [DF], proto TCP (6), length 64)
    10.0.0.5.53968 > 10.0.0.2.8000: Flags [.], cksum 0x1439 (incorrect -> 0x225f), ack 108601, win 180, options [nop,nop,TS val 886028439 ecr 3046261909,nop,nop,sack 1 {156385:157833}], length 0
1550703442.860431 IP (tos 0x0, ttl 64, id 49303, offset 0, flags [DF], proto TCP (6), length 1500)
    10.0.0.2.8000 > 10.0.0.5.53968: Flags [.], cksum 0x19d5 (incorrect -> 0x9200), seq 114393:115841, ack 179, win 30, options [nop,nop,TS val 3046261941 ecr 886028432], length 1448
1550703442.861787 IP (tos 0x0, ttl 64, id 26611, offset 0, flags [DF], proto TCP (6), length 64)
    10.0.0.5.53968 > 10.0.0.2.8000: Flags [.], cksum 0x1439 (incorrect -> 0x1c96), ack 110049, win 180, options [nop,nop,TS val 886028448 ecr 3046261933,nop,nop,sack 1 {156385:157833}], length 0
1550703442.866517 IP (tos 0x0, ttl 64, id 49304, offset 0, flags [DF], proto TCP (6), length 1500)
    10.0.0.2.8000 > 10.0.0.5.53968: Flags [.], cksum 0x19d5 (incorrect -> 0x3d83), seq 115841:117289, ack 179, win 30, options [nop,nop,TS val 3046261941 ecr 886028432], length 1448
1550703442.868433 IP (tos 0x0, ttl 64, id 26612, offset 0, flags [DF], proto TCP (6), length 64)
    10.0.0.5.53968 > 10.0.0.2.8000: Flags [.], cksum 0x1439 (incorrect -> 0x16e9), ack 111497, win 180, options [nop,nop,TS val 886028453 ecr 3046261933,nop,nop,sack 1 {156385:157833}], length 0
1550703442.873189 IP (tos 0x0, ttl 64, id 49305, offset 0, flags [DF], proto TCP (6), length 1500)
    10.0.0.2.8000 > 10.0.0.5.53968: Flags [.], cksum 0x19d5 (incorrect -> 0x6eeb), seq 117289:118737, ack 179, win 30, options [nop,nop,TS val 3046261949 ecr 886028439], length 1448
1550703442.874357 IP (tos 0x0, ttl 64, id 26613, offset 0, flags [DF], proto TCP (6), length 64)
