1550703431.740611 IP6 (hlim 1, next-header Options (0) payload length: 36) fe80::200:ff:fe00:5 > ff02::16: HBH (rtalert: 0x0000) (padn) [icmp6 sum ok] ICMP6, multicast listener report v2, 1 group record(s) [gaddr ff02::1:ff00:5 to_ex, 0 source(s)]
1550703431.790778 IP6 (flowlabel 0x430b6, hlim 255, next-header UDP (17) payload length: 53) fe80::e0c0:cfff:fe26:399a.5353 > ff02::fb.5353: [udp sum ok] 0 [2q] PTR (QM)? _ipps._tcp.local. PTR (QM)? _ipp._tcp.local. (45)
1550703431.919799 IP6 (flowlabel 0x6910d, hlim 255, next-header UDP (17) payload length: 158) fe80::9ce5:42ff:feed:32e7.5353 > ff02::fb.5353: [bad udp cksum 0x10e8 -> 0x4c53!] 0*- [0q] 2/0/0 7.e.2.3.d.e.e.f.f.f.2.4.5.e.c.9.0.0.0.0.0.0.0.0.0.0.0.0.0.8.e.f.ip6.arpa. (Cache flush) PTR gabriel-VirtualBox.local., gabriel-VirtualBox.local. (Cache flush) AAAA fe80::9ce5:42ff:feed:32e7 (150)
1550703432.055307 IP6 (flowlabel 0x68c11, hlim 255, next-header UDP (17) payload length: 53) fe80::20b7:51ff:fe59:c738.5353 > ff02::fb.5353: [udp sum ok] 0 [2q] PTR (QM)? _ipps._tcp.local. PTR (QM)? _ipp._tcp.local. (45)
1550703432.645826 IP6 (hlim 255, next-header ICMPv6 (58) payload length: 16) fe80::20b7:51ff:fe59:c738 > ff02::2: [icmp6 sum ok] ICMP6, router solicitation, length 16
	  source link-address option (1), length 8 (1): 22:b7:51:59:c7:38
1550703432.650456 IP6 (hlim 255, next-header ICMPv6 (58) payload length: 16) fe80::e0c0:cfff:fe26:399a > ff02::2: [icmp6 sum ok] ICMP6, router solicitation, length 16
	  source link-address option (1), length 8 (1): e2:c0:cf:26:39:9a
1550703432.838378 IP6 (flowlabel 0x6910d, hlim 255, next-header UDP (17) payload length: 53) fe80::9ce5:42ff:feed:32e7.5353 > ff02::fb.5353: [bad udp cksum 0x107f -> 0xc3fe!] 0 [2q] PTR (QM)? _ipps._tcp.local. PTR (QM)? _ipp._tcp.local. (45)
1550703433.079782 IP6 (flowlabel 0x430b6, hlim 255, next-header UDP (17) payload length: 158) fe80::e0c0:cfff:fe26:399a.5353 > ff02::fb.5353: [udp sum ok] 0*- [0q] 2/0/0 a.9.9.3.6.2.e.f.f.f.f.c.0.c.0.e.0.0.0.0.0.0.0.0.0.0.0.0.0.8.e.f.ip6.arpa. (Cache flush) PTR gabriel-VirtualBox.local., gabriel-VirtualBox.local. (Cache flush) AAAA fe80::e0c0:cfff:fe26:399a (150)
1550703433.300396 IP6 (flowlabel 0x68c11, hlim 255, next-header UDP (17) payload length: 158) fe80::20b7:51ff:fe59:c738.5353 > ff02::fb.5353: [udp sum ok] 0*- [0q] 2/0/0 8.3.7.c.9.5.e.f.f.f.1.5.7.b.0.2.0.0.0.0.0.0.0.0.0.0.0.0.0.8.e.f.ip6.arpa. (Cache flush) PTR gabriel-VirtualBox.local., gabriel-VirtualBox.local. (Cache flush) AAAA fe80::20b7:51ff:fe59:c738 (150)
1550703433.404160 IP6 (hlim 255, next-header ICMPv6 (58) payload length: 16) fe80::9ce5:42ff:feed:32e7 > ff02::2: [icmp6 sum ok] ICMP6, router solicitation, length 16
	  source link-address option (1), length 8 (1): 9e:e5:42:ed:32:e7
1550703434.141290 IP6 (flowlabel 0x6910d, hlim 255, next-header UDP (17) payload length: 158) fe80::9ce5:42ff:feed:32e7.5353 > ff02::fb.5353: [bad udp cksum 0x10e8 -> 0x4c53!] 0*- [0q] 2/0/0 7.e.2.3.d.e.e.f.f.f.2.4.5.e.c.9.0.0.0.0.0.0.0.0.0.0.0.0.0.8.e.f.ip6.arpa. (Cache flush) PTR gabriel-VirtualBox.local., gabriel-VirtualBox.local. (Cache flush) AAAA fe80::9ce5:42ff:feed:32e7 (150)
1550703434.472957 IP6 (hlim 255, next-header ICMPv6 (58) payload length: 16) fe80::200:ff:fe00:1 > ff02::2: [icmp6 sum ok] ICMP6, router solicitation, length 16
	  source link-address option (1), length 8 (1): 00:00:00:00:00:01
1550703434.472963 IP6 (hlim 255, next-header ICMPv6 (58) payload length: 16) fe80::200:ff:fe00:2 > ff02::2: [icmp6 sum ok] ICMP6, router solicitation, length 16
	  source link-address option (1), length 8 (1): 00:00:00:00:00:02
1550703434.708970 IP6 (hlim 255, next-header ICMPv6 (58) payload length: 16) fe80::200:ff:fe00:3 > ff02::2: [icmp6 sum ok] ICMP6, router solicitation, length 16
	  source link-address option (1), length 8 (1): 00:00:00:00:00:03
1550703435.196105 IP6 (hlim 255, next-header ICMPv6 (58) payload length: 16) fe80::200:ff:fe00:5 > ff02::2: [icmp6 sum ok] ICMP6, router solicitation, length 16
	  source link-address option (1), length 8 (1): 00:00:00:00:00:05
1550703435.210906 IP6 (hlim 255, next-header ICMPv6 (58) payload length: 16) fe80::200:ff:fe00:6 > ff02::2: [icmp6 sum ok] ICMP6, router solicitation, length 16
	  source link-address option (1), length 8 (1): 00:00:00:00:00:06
1550703435.467126 IP6 (hlim 255, next-header ICMPv6 (58) payload length: 16) fe80::200:ff:fe00:4 > ff02::2: [icmp6 sum ok] ICMP6, router solicitation, length 16
	  source link-address option (1), length 8 (1): 00:00:00:00:00:04
1550703435.815118 IP6 (flowlabel 0x430b6, hlim 255, next-header UDP (17) payload length: 53) fe80::e0c0:cfff:fe26:399a.5353 > ff02::fb.5353: [udp sum ok] 0 [2q] PTR (QM)? _ipps._tcp.local. PTR (QM)? _ipp._tcp.local. (45)
1550703435.889668 ARP, Ethernet (len 6), IPv4 (len 4), Request who-has 10.0.0.2 tell 10.0.0.5, length 28
1550703435.939297 ARP, Ethernet (len 6), IPv4 (len 4), Reply 10.0.0.2 is-at 00:00:00:00:00:02, length 28
1550703435.940920 IP (tos 0x0, ttl 64, id 26565, offset 0, flags [DF], proto TCP (6), length 60)
    10.0.0.5.53968 > 10.0.0.2.8000: Flags [S], cksum 0x1435 (incorrect -> 0xa0ad), seq 3683025256, win 29200, options [mss 1460,sackOK,TS val 886021481 ecr 0,nop,wscale 10], length 0
1550703435.982420 IP (tos 0x0, ttl 64, id 0, offset 0, flags [DF], proto TCP (6), length 60)
    10.0.0.2.8000 > 10.0.0.5.53968: Flags [S.], cksum 0xf7fa (correct), seq 2740791000, ack 3683025257, win 28960, options [mss 1460,sackOK,TS val 3046255049 ecr 886021481,nop,wscale 10], length 0
1550703435.985030 IP (tos 0x0, ttl 64, id 26566, offset 0, flags [DF], proto TCP (6), length 52)
    10.0.0.5.53968 > 10.0.0.2.8000: Flags [.], cksum 0x142d (incorrect -> 0x976f), ack 1, win 29, options [nop,nop,TS val 886021575 ecr 3046255049], length 0
1550703436.017351 IP (tos 0x0, ttl 64, id 26567, offset 0, flags [DF], proto TCP (6), length 230)
    10.0.0.5.53968 > 10.0.0.2.8000: Flags [P.], cksum 0x14df (incorrect -> 0x1de9), seq 1:179, ack 1, win 29, options [nop,nop,TS val 886021608 ecr 3046255049], length 178
1550703436.030205 IP (tos 0x0, ttl 64, id 49182, offset 0, flags [DF], proto TCP (6), length 52)
    10.0.0.2.8000 > 10.0.0.5.53968: Flags [.], cksum 0x9658 (correct), ack 179, win 30, options [nop,nop,TS val 3046255116 ecr 886021608], length 0
1550703436.049307 IP6 (flowlabel 0x68c11, hlim 255, next-header UDP (17) payload length: 53) fe80::20b7:51ff:fe59:c738.5353 > ff02::fb.5353: [udp sum ok] 0 [2q] PTR (QM)? _ipps._tcp.local. PTR (QM)? _ipp._tcp.local. (45)
1550703436.838539 IP6 (flowlabel 0x6910d, hlim 255, next-header UDP (17) payload length: 53) fe80::9ce5:42ff:feed:32e7.5353 > ff02::fb.5353: [bad udp cksum 0x107f -> 0xc3fe!] 0 [2q] PTR (QM)? _ipps._tcp.local. PTR (QM)? _ipp._tcp.local. (45)
1550703437.086181 IP (tos 0x0, ttl 64, id 49183, offset 0, flags [DF], proto TCP (6), length 2948)
    10.0.0.2.8000 > 10.0.0.5.53968: Flags [.], cksum 0x1f7d (incorrect -> 0xaff7), seq 1:2897, ack 179, win 30, options [nop,nop,TS val 3046256150 ecr 886021608], length 2896
1550703437.088343 IP (tos 0x0, ttl 64, id 26568, offset 0, flags [DF], proto TCP (6), length 52)
    10.0.0.5.53968 > 10.0.0.2.8000: Flags [.], cksum 0x142d (incorrect -> 0x82ca), ack 2897, win 35, options [nop,nop,TS val 886022679 ecr 3046256150], length 0
1550703437.151693 IP (tos 0x0, ttl 64, id 49185, offset 0, flags [DF], proto TCP (6), length 2948)
    10.0.0.2.8000 > 10.0.0.5.53968: Flags [.], cksum 0x1f7d (incorrect -> 0xac26), seq 2897:5793, ack 179, win 30, options [nop,nop,TS val 3046256150 ecr 886021608], length 2896
1550703437.155676 IP (tos 0x0, ttl 64, id 26569, offset 0, flags [DF], proto TCP (6), length 52)
    10.0.0.5.53968 > 10.0.0.2.8000: Flags [.], cksum 0x142d (incorrect -> 0x7734), ack 5793, win 40, options [nop,nop,TS val 886022744 ecr 3046256150], length 0
1550703437.288047 IP (tos 0x0, ttl 64, id 49187, offset 0, flags [DF], proto TCP (6), length 2948)
    10.0.0.2.8000 > 10.0.0.5.53968: Flags [.], cksum 0x1f7d (incorrect -> 0x3376), seq 5793:8689, ack 179, win 30, options [nop,nop,TS val 3046256150 ecr 886021608], length 2896
1550703437.289938 IP (tos 0x0, ttl 64, id 26570, offset 0, flags [DF], proto TCP (6), length 52)
    10.0.0.5.53968 > 10.0.0.2.8000: Flags [.], cksum 0x142d (incorrect -> 0x6b55), ack 8689, win 46, options [nop,nop,TS val 886022881 ecr 3046256150], length 0
1550703437.390262 IP (tos 0x0, ttl 64, id 49189, offset 0, flags [DF], proto TCP (6), length 2948)
    10.0.0.2.8000 > 10.0.0.5.53968: Flags [.], cksum 0x1f7d (incorrect -> 0xd3ae), seq 8689:11585, ack 179, win 30, options [nop,nop,TS val 3046256150 ecr 886021608], length 2896
1550703437.392475 IP (tos 0x0, ttl 64, id 26571, offset 0, flags [DF], proto TCP (6), length 52)
    10.0.0.5.53968 > 10.0.0.2.8000: Flags [.], cksum 0x142d (incorrect -> 0x5f99), ack 11585, win 52, options [nop,nop,TS val 886022983 ecr 3046256150], length 0
1550703437.512679 IP (tos 0x0, ttl 64, id 49191, offset 0, flags [DF], proto TCP (6), length 2948)
    10.0.0.2.8000 > 10.0.0.5.53968: Flags [.], cksum 0x1f7d (incorrect -> 0xd408), seq 11585:14481, ack 179, win 30, options [nop,nop,TS val 3046256150 ecr 886021608], length 2896
1550703437.514670 IP (tos 0x0, ttl 64, id 26572, offset 0, flags [DF], proto TCP (6), length 52)
    10.0.0.5.53968 > 10.0.0.2.8000: Flags [.], cksum 0x142d (incorrect -> 0x53ca), ack 14481, win 57, options [nop,nop,TS val 886023105 ecr 3046256150], length 0
1550703437.628104 IP (tos 0x0, ttl 64, id 49193, offset 0, flags [DF], proto TCP (6), length 1500)
    10.0.0.2.8000 > 10.0.0.5.53968: Flags [.], cksum 0x19d5 (incorrect -> 0xcbd4), seq 14481:15929, ack 179, win 30, options [nop,nop,TS val 3046256230 ecr 886021608], length 1448
1550703437.630276 IP (tos 0x0, ttl 64, id 26573, offset 0, flags [DF], proto TCP (6), length 52)
    10.0.0.5.53968 > 10.0.0.2.8000: Flags [.], cksum 0x142d (incorrect -> 0x4d5b), ack 15929, win 60, options [nop,nop,TS val 886023221 ecr 3046256230], length 0
1550703437.689873 IP (tos 0x0, ttl 64, id 49194, offset 0, flags [DF], proto TCP (6), length 2948)
    10.0.0.2.8000 > 10.0.0.5.53968: Flags [.], cksum 0x1f7d (incorrect -> 0x13dc), seq 15929:18825, ack 179, win 30, options [nop,nop,TS val 3046256244 ecr 886022679], length 2896
1550703437.704116 IP (tos 0x0, ttl 64, id 26574, offset 0, flags [DF], proto TCP (6), length 52)
    10.0.0.5.53968 > 10.0.0.2.8000: Flags [.], cksum 0x142d (incorrect -> 0x41b9), ack 18825, win 66, options [nop,nop,TS val 886023283 ecr 3046256244], length 0
1550703437.810747 IP (tos 0x0, ttl 64, id 49196, offset 0, flags [DF], proto TCP (6), length 2948)
    10.0.0.2.8000 > 10.0.0.5.53968: Flags [.], cksum 0x1f7d (incorrect -> 0xc833), seq 18825:21721, ack 179, win 30, options [nop,nop,TS val 3046256254 ecr 886022744], length 2896
1550703437.813324 IP (tos 0x0, ttl 64, id 26575, offset 0, flags [DF], proto TCP (6), length 52)
    10.0.0.5.53968 > 10.0.0.2.8000: Flags [.], cksum 0x142d (incorrect -> 0x35e2), ack 21721, win 71, options [nop,nop,TS val 886023403 ecr 3046256254], length 0
1550703437.932044 IP (tos 0x0, ttl 64, id 49198, offset 0, flags [DF], proto TCP (6), length 2948)
    10.0.0.2.8000 > 10.0.0.5.53968: Flags [.], cksum 0x1f7d (incorrect -> 0x727f), seq 21721:24617, ack 179, win 30, options [nop,nop,TS val 3046256254 ecr 886022744], length 2896
1550703437.935489 IP (tos 0x0, ttl 64, id 26576, offset 0, flags [DF], proto TCP (6), length 52)
    10.0.0.5.53968 > 10.0.0.2.8000: Flags [.], cksum 0x142d (incorrect -> 0x2a12), ack 24617, win 77, options [nop,nop,TS val 886023525 ecr 3046256254], length 0
1550703438.084035 IP (tos 0x0, ttl 64, id 49200, offset 0, flags [DF], proto TCP (6), length 2948)
    10.0.0.2.8000 > 10.0.0.5.53968: Flags [.], cksum 0x1f7d (incorrect -> 0xeae1), seq 24617:27513, ack 179, win 30, options [nop,nop,TS val 3046256398 ecr 886022881], length 2896
1550703438.086715 IP (tos 0x0, ttl 64, id 26577, offset 0, flags [DF], proto TCP (6), length 52)
    10.0.0.5.53968 > 10.0.0.2.8000: Flags [.], cksum 0x142d (incorrect -> 0x1d94), ack 27513, win 83, options [nop,nop,TS val 886023677 ecr 3046256398], length 0
1550703438.184484 IP (tos 0x0, ttl 64, id 49202, offset 0, flags [DF], proto TCP (6), length 1500)
    10.0.0.2.8000 > 10.0.0.5.53968: Flags [P.], cksum 0x19d5 (incorrect -> 0x61cc), seq 27513:28961, ack 179, win 30, options [nop,nop,TS val 3046256398 ecr 886022881], length 1448
1550703438.186673 IP (tos 0x0, ttl 64, id 26578, offset 0, flags [DF], proto TCP (6), length 52)
    10.0.0.5.53968 > 10.0.0.2.8000: Flags [.], cksum 0x142d (incorrect -> 0x1785), ack 28961, win 86, options [nop,nop,TS val 886023777 ecr 3046256398], length 0
1550703438.233822 IP (tos 0x0, ttl 64, id 49203, offset 0, flags [DF], proto TCP (6), length 2948)
    10.0.0.2.8000 > 10.0.0.5.53968: Flags [.], cksum 0x1f7d (incorrect -> 0x8bf0), seq 28961:31857, ack 179, win 30, options [nop,nop,TS val 3046256398 ecr 886022881], length 2896
1550703438.235496 IP (tos 0x0, ttl 64, id 26579, offset 0, flags [DF], proto TCP (6), length 52)
    10.0.0.5.53968 > 10.0.0.2.8000: Flags [.], cksum 0x142d (incorrect -> 0x0bfe), ack 31857, win 91, options [nop,nop,TS val 886023827 ecr 3046256398], length 0
1550703438.354901 IP (tos 0x0, ttl 64, id 49205, offset 0, flags [DF], proto TCP (6), length 2948)
    10.0.0.2.8000 > 10.0.0.5.53968: Flags [.], cksum 0x1f7d (incorrect -> 0x1fef), seq 31857:34753, ack 179, win 30, options [nop,nop,TS val 3046256520 ecr 886022983], length 2896
1550703438.356898 IP (tos 0x0, ttl 64, id 26580, offset 0, flags [DF], proto TCP (6), length 52)
    10.0.0.5.53968 > 10.0.0.2.8000: Flags [.], cksum 0x142d (incorrect -> 0xffb4), ack 34753, win 97, options [nop,nop,TS val 886023948 ecr 3046256520], length 0
1550703438.492583 IP (tos 0x0, ttl 64, id 49207, offset 0, flags [DF], proto TCP (6), length 2948)
    10.0.0.2.8000 > 10.0.0.5.53968: Flags [.], cksum 0x1f7d (incorrect -> 0x2e33), seq 34753:37649, ack 179, win 30, options [nop,nop,TS val 3046256520 ecr 886022983], length 2896
1550703438.493908 IP (tos 0x0, ttl 64, id 26581, offset 0, flags [DF], proto TCP (6), length 52)
    10.0.0.5.53968 > 10.0.0.2.8000: Flags [.], cksum 0x142d (incorrect -> 0xf3d5), ack 37649, win 103, options [nop,nop,TS val 886024085 ecr 3046256520], length 0
1550703438.602138 IP (tos 0x0, ttl 64, id 49209, offset 0, flags [DF], proto TCP (6), length 2948)
    10.0.0.2.8000 > 10.0.0.5.53968: Flags [.], cksum 0x1f7d (incorrect -> 0x49df), seq 37649:40545, ack 179, win 30, options [nop,nop,TS val 3046256634 ecr 886023105], length 2896
1550703438.603629 IP (tos 0x0, ttl 64, id 26582, offset 0, flags [DF], proto TCP (6), length 52)
    10.0.0.5.53968 > 10.0.0.2.8000: Flags [.], cksum 0x142d (incorrect -> 0xe7a0), ack 40545, win 108, options [nop,nop,TS val 886024195 ecr 3046256634], length 0
1550703438.738973 IP (tos 0x0, ttl 64, id 49211, offset 0, flags [DF], proto TCP (6), length 2948)
    10.0.0.2.8000 > 10.0.0.5.53968: Flags [P.], cksum 0x1f7d (incorrect -> 0x7db9), seq 40545:43441, ack 179, win 30, options [nop,nop,TS val 3046256634 ecr 886023105], length 2896
1550703438.740974 IP (tos 0x0, ttl 64, id 26583, offset 0, flags [DF], proto TCP (6), length 52)
    10.0.0.5.53968 > 10.0.0.2.8000: Flags [.], cksum 0x142d (incorrect -> 0xdbc1), ack 43441, win 114, options [nop,nop,TS val 886024332 ecr 3046256634], length 0
1550703438.840879 IP (tos 0x0, ttl 64, id 49213, offset 0, flags [DF], proto TCP (6), length 2948)
    10.0.0.2.8000 > 10.0.0.5.53968: Flags [.], cksum 0x1f7d (incorrect -> 0xa15b), seq 43441:46337, ack 179, win 30, options [nop,nop,TS val 3046256728 ecr 886023221], length 2896
1550703438.843265 IP (tos 0x0, ttl 64, id 26584, offset 0, flags [DF], proto TCP (6), length 52)
    10.0.0.5.53968 > 10.0.0.2.8000: Flags [.], cksum 0x142d (incorrect -> 0xcfa7), ack 46337, win 120, options [nop,nop,TS val 886024434 ecr 3046256728], length 0
1550703438.962037 IP (tos 0x0, ttl 64, id 49215, offset 0, flags [DF], proto TCP (6), length 2948)
    10.0.0.2.8000 > 10.0.0.5.53968: Flags [.], cksum 0x1f7d (incorrect -> 0x405c), seq 46337:49233, ack 179, win 30, options [nop,nop,TS val 3046256814 ecr 886023283], length 2896
1550703438.963804 IP (tos 0x0, ttl 64, id 26585, offset 0, flags [DF], proto TCP (6), length 52)
    10.0.0.5.53968 > 10.0.0.2.8000: Flags [.], cksum 0x142d (incorrect -> 0xc383), ack 49233, win 125, options [nop,nop,TS val 886024555 ecr 3046256814], length 0
1550703439.083150 IP (tos 0x0, ttl 64, id 49217, offset 0, flags [DF], proto TCP (6), length 2948)
    10.0.0.2.8000 > 10.0.0.5.53968: Flags [.], cksum 0x1f7d (incorrect -> 0x9e72), seq 49233:52129, ack 179, win 30, options [nop,nop,TS val 3046256814 ecr 886023283], length 2896
1550703439.085131 IP (tos 0x0, ttl 64, id 26586, offset 0, flags [DF], proto TCP (6), length 52)
    10.0.0.5.53968 > 10.0.0.2.8000: Flags [.], cksum 0x142d (incorrect -> 0xb7b4), ack 52129, win 131, options [nop,nop,TS val 886024676 ecr 3046256814], length 0
1550703439.202769 IP (tos 0x0, ttl 64, id 49219, offset 0, flags [DF], proto TCP (6), length 2948)
    10.0.0.2.8000 > 10.0.0.5.53968: Flags [.], cksum 0x1f7d (incorrect -> 0x800e), seq 52129:55025, ack 179, win 30, options [nop,nop,TS val 3046256926 ecr 886023403], length 2896
1550703439.209136 IP (tos 0x0, ttl 64, id 26587, offset 0, flags [DF], proto TCP (6), length 52)
    10.0.0.5.53968 > 10.0.0.2.8000: Flags [.], cksum 0x142d (incorrect -> 0xab78), ack 55025, win 136, options [nop,nop,TS val 886024795 ecr 3046256926], length 0
1550703439.324049 IP (tos 0x0, ttl 64, id 49221, offset 0, flags [DF], proto TCP (6), length 2948)
    10.0.0.2.8000 > 10.0.0.5.53968: Flags [.], cksum 0x1f7d (incorrect -> 0x126a), seq 55025:57921, ack 179, win 30, options [nop,nop,TS val 3046256926 ecr 886023403], length 2896
1550703439.328961 IP (tos 0x0, ttl 64, id 26588, offset 0, flags [DF], proto TCP (6), length 52)
    10.0.0.5.53968 > 10.0.0.2.8000: Flags [.], cksum 0x142d (incorrect -> 0x9fa8), ack 57921, win 142, options [nop,nop,TS val 886024917 ecr 3046256926], length 0
1550703439.446442 IP (tos 0x0, ttl 64, id 49223, offset 0, flags [DF], proto TCP (6), length 2948)
    10.0.0.2.8000 > 10.0.0.5.53968: Flags [.], cksum 0x1f7d (incorrect -> 0xf48c), seq 57921:60817, ack 179, win 30, options [nop,nop,TS val 3046257033 ecr 886023525], length 2896
1550703439.447950 IP (tos 0x0, ttl 64, id 26589, offset 0, flags [DF], proto TCP (6), length 52)
    10.0.0.5.53968 > 10.0.0.2.8000: Flags [.], cksum 0x142d (incorrect -> 0x936d), ack 60817, win 148, options [nop,nop,TS val 886025039 ecr 3046257033], length 0
1550703439.565927 IP (tos 0x0, ttl 64, id 49225, offset 0, flags [DF], proto TCP (6), length 2948)
    10.0.0.2.8000 > 10.0.0.5.53968: Flags [.], cksum 0x1f7d (incorrect -> 0x0dd8), seq 60817:63713, ack 179, win 30, options [nop,nop,TS val 3046257033 ecr 886023525], length 2896
1550703439.567912 IP (tos 0x0, ttl 64, id 26590, offset 0, flags [DF], proto TCP (6), length 52)
    10.0.0.5.53968 > 10.0.0.2.8000: Flags [.], cksum 0x142d (incorrect -> 0x87a0), ack 63713, win 153, options [nop,nop,TS val 886025159 ecr 3046257033], length 0
1550703439.687076 IP (tos 0x0, ttl 64, id 49227, offset 0, flags [DF], proto TCP (6), length 2948)
    10.0.0.2.8000 > 10.0.0.5.53968: Flags [.], cksum 0x1f7d (incorrect -> 0x5dc3), seq 63713:66609, ack 179, win 30, options [nop,nop,TS val 3046257186 ecr 886023677], length 2896
1550703439.688589 IP (tos 0x0, ttl 64, id 26591, offset 0, flags [DF], proto TCP (6), length 52)
    10.0.0.5.53968 > 10.0.0.2.8000: Flags [.], cksum 0x142d (incorrect -> 0x7b38), ack 66609, win 159, options [nop,nop,TS val 886025280 ecr 3046257186], length 0
1550703439.810674 IP (tos 0x0, ttl 64, id 49229, offset 0, flags [DF], proto TCP (6), length 2948)
    10.0.0.2.8000 > 10.0.0.5.53968: Flags [.], cksum 0x1f7d (incorrect -> 0xdeba), seq 66609:69505, ack 179, win 30, options [nop,nop,TS val 3046257186 ecr 886023677], length 2896
1550703439.812594 IP (tos 0x0, ttl 64, id 26592, offset 0, flags [DF], proto TCP (6), length 52)
    10.0.0.5.53968 > 10.0.0.2.8000: Flags [.], cksum 0x142d (incorrect -> 0x6f67), ack 69505, win 165, options [nop,nop,TS val 886025403 ecr 3046257186], length 0
1550703439.929794 IP (tos 0x0, ttl 64, id 49231, offset 0, flags [DF], proto TCP (6), length 2948)
    10.0.0.2.8000 > 10.0.0.5.53968: Flags [P.], cksum 0x1f7d (incorrect -> 0xfff7), seq 69505:72401, ack 179, win 30, options [nop,nop,TS val 3046257287 ecr 886023777], length 2896
1550703439.930915 IP (tos 0x0, ttl 64, id 26593, offset 0, flags [DF], proto TCP (6), length 52)
    10.0.0.5.53968 > 10.0.0.2.8000: Flags [.], cksum 0x142d (incorrect -> 0x6335), ack 72401, win 170, options [nop,nop,TS val 886025523 ecr 3046257287], length 0
1550703440.050561 IP (tos 0x0, ttl 64, id 49233, offset 0, flags [DF], proto TCP (6), length 2948)
    10.0.0.2.8000 > 10.0.0.5.53968: Flags [.], cksum 0x1f7d (incorrect -> 0x3e55), seq 72401:75297, ack 179, win 30, options [nop,nop,TS val 3046257334 ecr 886023827], length 2896
1550703440.052278 IP (tos 0x0, ttl 64, id 26594, offset 0, flags [DF], proto TCP (6), length 52)
    10.0.0.5.53968 > 10.0.0.2.8000: Flags [.], cksum 0x142d (incorrect -> 0x5738), ack 75297, win 176, options [nop,nop,TS val 886025643 ecr 3046257334], length 0
1550703440.171809 IP (tos 0x0, ttl 64, id 49235, offset 0, flags [DF], proto TCP (6), length 2948)
    10.0.0.2.8000 > 10.0.0.5.53968: Flags [.], cksum 0x1f7d (incorrect -> 0xacbd), seq 75297:78193, ack 179, win 30, options [nop,nop,TS val 3046257334 ecr 886023827], length 2896
1550703440.173459 IP (tos 0x0, ttl 64, id 26595, offset 0, flags [DF], proto TCP (6), length 52)
    10.0.0.5.53968 > 10.0.0.2.8000: Flags [.], cksum 0x142d (incorrect -> 0x4b6a), ack 78193, win 180, options [nop,nop,TS val 886025765 ecr 3046257334], length 0
1550703440.293696 IP (tos 0x0, ttl 64, id 49237, offset 0, flags [DF], proto TCP (6), length 2948)
    10.0.0.2.8000 > 10.0.0.5.53968: Flags [.], cksum 0x1f7d (incorrect -> 0x6a3b), seq 78193:81089, ack 179, win 30, options [nop,nop,TS val 3046257472 ecr 886023948], length 2896
1550703440.295920 IP (tos 0x0, ttl 64, id 26596, offset 0, flags [DF], proto TCP (6), length 52)
    10.0.0.5.53968 > 10.0.0.2.8000: Flags [.], cksum 0x142d (incorrect -> 0x3f17), ack 81089, win 180, options [nop,nop,TS val 886025886 ecr 3046257472], length 0
1550703440.414141 IP (tos 0x0, ttl 64, id 49239, offset 0, flags [DF], proto TCP (6), length 2948)
    10.0.0.2.8000 > 10.0.0.5.53968: Flags [.], cksum 0x1f7d (incorrect -> 0x7125), seq 81089:83985, ack 179, win 30, options [nop,nop,TS val 3046257472 ecr 886023948], length 2896
1550703440.415833 IP (tos 0x0, ttl 64, id 26597, offset 0, flags [DF], proto TCP (6), length 52)
    10.0.0.5.53968 > 10.0.0.2.8000: Flags [.], cksum 0x142d (incorrect -> 0x334e), ack 83985, win 180, options [nop,nop,TS val 886026007 ecr 3046257472], length 0
1550703440.535379 IP (tos 0x0, ttl 64, id 49241, offset 0, flags [DF], proto TCP (6), length 2948)
    10.0.0.2.8000 > 10.0.0.5.53968: Flags [.], cksum 0x1f7d (incorrect -> 0x50cf), seq 83985:86881, ack 179, win 30, options [nop,nop,TS val 3046257592 ecr 886024085], length 2896
1550703440.536978 IP (tos 0x0, ttl 64, id 26598, offset 0, flags [DF], proto TCP (6), length 52)
    10.0.0.5.53968 > 10.0.0.2.8000: Flags [.], cksum 0x142d (incorrect -> 0x270d), ack 86881, win 180, options [nop,nop,TS val 886026128 ecr 3046257592], length 0
1550703440.660764 IP (tos 0x0, ttl 64, id 49243, offset 0, flags [DF], proto TCP (6), length 2948)
    10.0.0.2.8000 > 10.0.0.5.53968: Flags [.], cksum 0x1f7d (incorrect -> 0x63ee), seq 86881:89777, ack 179, win 30, options [nop,nop,TS val 3046257592 ecr 886024085], length 2896
1550703440.662170 IP (tos 0x0, ttl 64, id 26599, offset 0, flags [DF], proto TCP (6), length 52)
    10.0.0.5.53968 > 10.0.0.2.8000: Flags [.], cksum 0x142d (incorrect -> 0x1b40), ack 89777, win 180, options [nop,nop,TS val 886026253 ecr 3046257592], length 0
1550703440.777076 IP (tos 0x0, ttl 64, id 49245, offset 0, flags [DF], proto TCP (6), length 2948)
    10.0.0.2.8000 > 10.0.0.5.53968: Flags [.], cksum 0x1f7d (incorrect -> 0x3656), seq 89777:92673, ack 179, win 30, options [nop,nop,TS val 3046257702 ecr 886024195], length 2896
1550703440.779021 IP (tos 0x0, ttl 64, id 26600, offset 0, flags [DF], proto TCP (6), length 52)
    10.0.0.5.53968 > 10.0.0.2.8000: Flags [.], cksum 0x142d (incorrect -> 0x0f0d), ack 92673, win 180, options [nop,nop,TS val 886026370 ecr 3046257702], length 0
1550703440.898156 IP (tos 0x0, ttl 64, id 49247, offset 0, flags [DF], proto TCP (6), length 2948)
    10.0.0.2.8000 > 10.0.0.5.53968: Flags [.], cksum 0x1f7d (incorrect -> 0xd131), seq 92673:95569, ack 179, win 30, options [nop,nop,TS val 3046257702 ecr 886024195], length 2896
1550703440.905284 IP (tos 0x0, ttl 64, id 26601, offset 0, flags [DF], proto TCP (6), length 52)
    10.0.0.5.53968 > 10.0.0.2.8000: Flags [.], cksum 0x142d (incorrect -> 0x0344), ack 95569, win 180, options [nop,nop,TS val 886026491 ecr 3046257702], length 0
1550703441.019997 IP (tos 0x0, ttl 64, id 49249, offset 0, flags [DF], proto TCP (6), length 2948)
    10.0.0.2.8000 > 10.0.0.5.53968: Flags [.], cksum 0x1f7d (incorrect -> 0xffaa), seq 95569:98465, ack 179, win 30, options [nop,nop,TS val 3046257840 ecr 886024332], length 2896
1550703441.022189 IP (tos 0x0, ttl 64, id 26602, offset 0, flags [DF], proto TCP (6), length 52)
    10.0.0.5.53968 > 10.0.0.2.8000: Flags [.], cksum 0x142d (incorrect -> 0xf6ef), ack 98465, win 180, options [nop,nop,TS val 886026613 ecr 3046257840], length 0
1550703442.383323 IP6 (hlim 255, next-header ICMPv6 (58) payload length: 16) fe80::200:ff:fe00:2 > ff02::2: [icmp6 sum ok] ICMP6, router solicitation, length 16
	  source link-address option (1), length 8 (1): 00:00:00:00:00:02
1550703442.638350 IP6 (hlim 255, next-header ICMPv6 (58) payload length: 16) fe80::200:ff:fe00:1 > ff02::2: [icmp6 sum ok] ICMP6, router solicitation, length 16
	  source link-address option (1), length 8 (1): 00:00:00:00:00:01
1550703442.757538 IP (tos 0x0, ttl 64, id 49291, offset 0, flags [DF], proto TCP (6), length 1500)
    10.0.0.2.8000 > 10.0.0.5.53968: Flags [.], cksum 0x19d5 (incorrect -> 0x154e), seq 156385:157833, ack 179, win 30, options [nop,nop,TS val 3046261839 ecr 886026613], length 1448
1550703442.758868 IP (tos 0x0, ttl 64, id 26603, offset 0, flags [DF], proto TCP (6), length 64)
    10.0.0.5.53968 > 10.0.0.2.8000: Flags [.], cksum 0x1439 (incorrect -> 0x5a34), ack 98465, win 181, options [nop,nop,TS val 886028350 ecr 3046257840,nop,nop,sack 1 {156385:157833}], length 0
1550703442.778202 IP (tos 0x0, ttl 64, id 49292, offset 0, flags [DF], proto TCP (6), length 1500)
    10.0.0.2.8000 > 10.0.0.5.53968: Flags [.], cksum 0x19d5 (incorrect -> 0xac88), seq 98465:99913, ack 179, win 30, options [nop,nop,TS val 3046261858 ecr 886028350], length 1448
1550703442.785144 IP (tos 0x0, ttl 64, id 26604, offset 0, flags [DF], proto TCP (6), length 64)
    10.0.0.5.53968 > 10.0.0.2.8000: Flags [.], cksum 0x1439 (incorrect -> 0x44c6), ack 99913, win 180, options [nop,nop,TS val 886028371 ecr 3046261858,nop,nop,sack 1 {156385:157833}], length 0
1550703442.807520 IP (tos 0x0, ttl 64, id 49293, offset 0, flags [DF], proto TCP (6), length 1500)
    10.0.0.2.8000 > 10.0.0.5.53968: Flags [.], cksum 0x19d5 (incorrect -> 0x7f2d), seq 99913:101361, ack 179, win 30, options [nop,nop,TS val 3046261882 ecr 886028371], length 1448
1550703442.808939 IP (tos 0x0, ttl 64, id 26605, offset 0, flags [DF], proto TCP (6), length 64)
    10.0.0.5.53968 > 10.0.0.2.8000: Flags [.], cksum 0x1439 (incorrect -> 0x3ee9), ack 101361, win 180, options [nop,nop,TS val 886028400 ecr 3046261882,nop,nop,sack 1 {156385:157833}], length 0
1550703442.808943 IP (tos 0x0, ttl 64, id 49294, offset 0, flags [DF], proto TCP (6), length 1500)
    10.0.0.2.8000 > 10.0.0.5.53968: Flags [.], cksum 0x19d5 (incorrect -> 0x4c49), seq 101361:102809, ack 179, win 30, options [nop,nop,TS val 3046261882 ecr 886028371], length 1448
1550703442.810526 IP (tos 0x0, ttl 64, id 26606, offset 0, flags [DF], proto TCP (6), length 64)
    10.0.0.5.53968 > 10.0.0.2.8000: Flags [.], cksum 0x1439 (incorrect -> 0x3940), ack 102809, win 179, options [nop,nop,TS val 886028402 ecr 3046261882,nop,nop,sack 1 {156385:157833}], length 0
1550703442.827086 IP (tos 0x0, ttl 64, id 49295, offset 0, flags [DF], proto TCP (6), length 1500)
    10.0.0.2.8000 > 10.0.0.5.53968: Flags [.], cksum 0x19d5 (incorrect -> 0x2bd3), seq 102809:104257, ack 179, win 30, options [nop,nop,TS val 3046261907 ecr 886028400], length 1448
1550703442.829301 IP (tos 0x0, ttl 64, id 26607, offset 0, flags [DF], proto TCP (6), length 64)
    10.0.0.5.53968 > 10.0.0.2.8000: Flags [.], cksum 0x1439 (incorrect -> 0x336c), ack 104257, win 180, options [nop,nop,TS val 886028420 ecr 3046261907,nop,nop,sack 1 {156385:157833}], length 0
1550703442.837135 IP (tos 0x0, ttl 64, id 49296, offset 0, flags [DF], proto TCP (6), length 1500)
    10.0.0.2.8000 > 10.0.0.5.53968: Flags [.], cksum 0x19d5 (incorrect -> 0x3832), seq 104257:105705, ack 179, win 30, options [nop,nop,TS val 3046261907 ecr 886028400], length 1448
1550703442.838721 IP (tos 0x0, ttl 64, id 26608, offset 0, flags [DF], proto TCP (6), length 64)
    10.0.0.5.53968 > 10.0.0.2.8000: Flags [.], cksum 0x1439 (incorrect -> 0x2dba), ack 105705, win 180, options [nop,nop,TS val 886028430 ecr 3046261907,nop,nop,sack 1 {156385:157833}], length 0
1550703442.839215 IP (tos 0x0, ttl 64, id 49297, offset 0, flags [DF], proto TCP (6), length 1500)
    10.0.0.2.8000 > 10.0.0.5.53968: Flags [.], cksum 0x19d5 (incorrect -> 0xed9e), seq 105705:107153, ack 179, win 30, options [nop,nop,TS val 3046261909 ecr 886028402], length 1448
1550703442.840797 IP (tos 0x0, ttl 64, id 26609, offset 0, flags [DF], proto TCP (6), length 64)
    10.0.0.5.53968 > 10.0.0.2.8000: Flags [.], cksum 0x1439 (incorrect -> 0x280f), ack 107153, win 179, options [nop,nop,TS val 886028432 ecr 3046261909,nop,nop,sack 1 {156385:157833}], length 0
1550703442.846463 IP (tos 0x0, ttl 64, id 49298, offset 0, flags [DF], proto TCP (6), length 1500)
    10.0.0.2.8000 > 10.0.0.5.53968: Flags [.], cksum 0x19d5 (incorrect -> 0xb3fe), seq 107153:108601, ack 179, win 30, options [nop,nop,TS val 3046261909 ecr 886028402], length 1448
1550703442.847827 IP (tos 0x0, ttl 64, id 26610, offset 0, flags [DF], proto TCP (6), length 64)
    10.0.0.5.53968 > 10.0.0.2.8000: Flags [.], cksum 0x1439 (incorrect -> 0x225f), ack 108601, win 180, options [nop,nop,TS val 886028439 ecr 3046261909,nop,nop,sack 1 {156385:157833}], length 0
1550703442.854994 IP (tos 0x0, ttl 64, id 49299, offset 0, flags [DF], proto TCP (6), length 1500)
    10.0.0.2.8000 > 10.0.0.5.53968: Flags [.], cksum 0x19d5 (incorrect -> 0x7534), seq 108601:110049, ack 179, win 30, options [nop,nop,TS val 3046261933 ecr 886028420], length 1448
1550703442.856592 IP (tos 0x0, ttl 64, id 26611, offset 0, flags [DF], proto TCP (6), length 64)
    10.0.0.5.53968 > 10.0.0.2.8000: Flags [.], cksum 0x1439 (incorrect -> 0x1c96), ack 110049, win 180, options [nop,nop,TS val 886028448 ecr 3046261933,nop,nop,sack 1 {156385:157833}], length 0
1550703442.860439 IP (tos 0x0, ttl 64, id 49300, offset 0, flags [DF], proto TCP (6), length 1500)
    10.0.0.2.8000 > 10.0.0.5.53968: Flags [.], cksum 0x19d5 (incorrect -> 0xeec3), seq 110049:111497, ack 179, win 30, options [nop,nop,TS val 3046261933 ecr 886028420], length 1448
1550703442.861707 IP (tos 0x0, ttl 64, id 26612, offset 0, flags [DF], proto TCP (6), length 64)
    10.0.0.5.53968 > 10.0.0.2.8000: Flags [.], cksum 0x1439 (incorrect -> 0x16e9), ack 111497, win 180, options [nop,nop,TS val 886028453 ecr 3046261933,nop,nop,sack 1 {156385:157833}], length 0
1550703442.866617 IP (tos 0x0, ttl 64, id 49301, offset 0, flags [DF], proto TCP (6), length 1500)
    10.0.0.2.8000 > 10.0.0.5.53968: Flags [.], cksum 0x19d5 (incorrect -> 0xcb4b), seq 111497:112945, ack 179, win 30, options [nop,nop,TS val 3046261939 ecr 886028430], length 1448
1550703442.868430 IP (tos 0x0, ttl 64, id 26613, offset 0, flags [DF], proto TCP (6), length 64)
    10.0.0.5.53968 > 10.0.0.2.8000: Flags [.], cksum 0x1439 (incorrect -> 0x1135), ack 112945, win 180, options [nop,nop,TS val 886028459 ecr 3046261939,nop,nop,sack 1 {156385:157833}], length 0
1550703442.873211 IP (tos 0x0, ttl 64, id 49302, offset 0, flags [DF], proto TCP (6), length 1500)
    10.0.0.2.8000 > 10.0.0.5.53968: Flags [.], cksum 0x19d5 (incorrect -> 0x14be), seq 112945:114393, ack 179, win 30, options [nop,nop,TS val 3046261939 ecr 886028430], length 1448
1550703442.875086 IP (tos 0x0, ttl 64, id 26614, offset 0, flags [DF], proto TCP (6), length 64)
    10.0.0.5.53968 > 10.0.0.2.8000: Flags [.], cksum 0x1439 (incorrect -> 0x0b86), ack 114393, win 180, options [nop,nop,TS val 886028466 ecr 3046261939,nop,nop,sack 1 {156385:157833}], length 0
1550703442.885397 IP (tos 0x0, ttl 64, id 49303, offset 0, flags [DF], proto TCP (6), length 1500)
    10.0.0.2.8000 > 10.0.0.5.53968: Flags [.], cksum 0x19d5 (incorrect -> 0x9200), seq 114393:115841, ack 179, win 30, options [nop,nop,TS val 3046261941 ecr 886028432], length 1448
1550703442.887042 IP (tos 0x0, ttl 64, id 49304, offset 0, flags [DF], proto TCP (6), length 1500)
    10.0.0.2.8000 > 10.0.0.5.53968: Flags [.], cksum 0x19d5 (incorrect -> 0x3d83), seq 115841:117289, ack 179, win 30, options [nop,nop,TS val 3046261941 ecr 886028432], length 1448
1550703442.887057 IP (tos 0x0, ttl 64, id 26615, offset 0, flags [DF], proto TCP (6), length 64)
    10.0.0.5.53968 > 10.0.0.2.8000: Flags [.], cksum 0x1439 (incorrect -> 0x05d0), ack 115841, win 180, options [nop,nop,TS val 886028478 ecr 3046261941,nop,nop,sack 1 {156385:157833}], length 0
1550703442.888932 IP (tos 0x0, ttl 64, id 26616, offset 0, flags [DF], proto TCP (6), length 64)
    10.0.0.5.53968 > 10.0.0.2.8000: Flags [.], cksum 0x1439 (incorrect -> 0x0027), ack 117289, win 179, options [nop,nop,TS val 886028480 ecr 3046261941,nop,nop,sack 1 {156385:157833}], length 0
1550703442.890885 IP (tos 0x0, ttl 64, id 49305, offset 0, flags [DF], proto TCP (6), length 1500)
    10.0.0.2.8000 > 10.0.0.5.53968: Flags [.], cksum 0x19d5 (incorrect -> 0x6eeb), seq 117289:118737, ack 179, win 30, options [nop,nop,TS val 3046261949 ecr 886028439], length 1448
1550703442.892712 IP (tos 0x0, ttl 64, id 26617, offset 0, flags [DF], proto TCP (6), length 64)
    10.0.0.5.53968 > 10.0.0.2.8000: Flags [.], cksum 0x1439 (incorrect -> 0xfa71), ack 118737, win 180, options [nop,nop,TS val 886028484 ecr 3046261949,nop,nop,sack 1 {156385:157833}], length 0
1550703442.896952 IP (tos 0x0, ttl 64, id 49306, offset 0, flags [DF], proto TCP (6), length 1500)
    10.0.0.2.8000 > 10.0.0.5.53968: Flags [.], cksum 0x19d5 (incorrect -> 0x3041), seq 118737:120185, ack 179, win 30, options [nop,nop,TS val 3046261949 ecr 886028439], length 1448
1550703442.898807 IP (tos 0x0, ttl 64, id 26618, offset 0, flags [DF], proto TCP (6), length 64)
    10.0.0.5.53968 > 10.0.0.2.8000: Flags [.], cksum 0x1439 (incorrect -> 0xf4c3), ack 120185, win 180, options [nop,nop,TS val 886028490 ecr 3046261949,nop,nop,sack 1 {156385:157833}], length 0
1550703442.903094 IP (tos 0x0, ttl 64, id 49307, offset 0, flags [DF], proto TCP (6), length 1500)
    10.0.0.2.8000 > 10.0.0.5.53968: Flags [.], cksum 0x19d5 (incorrect -> 0x04d0), seq 120185:121633, ack 179, win 30, options [nop,nop,TS val 3046261955 ecr 886028448], length 1448
1550703442.908421 IP (tos 0x0, ttl 64, id 26619, offset 0, flags [DF], proto TCP (6), length 64)
    10.0.0.5.53968 > 10.0.0.2.8000: Flags [.], cksum 0x1439 (incorrect -> 0xef0f), ack 121633, win 180, options [nop,nop,TS val 886028496 ecr 3046261955,nop,nop,sack 1 {156385:157833}], length 0
1550703442.909000 IP (tos 0x0, ttl 64, id 49308, offset 0, flags [DF], proto TCP (6), length 1500)
    10.0.0.2.8000 > 10.0.0.5.53968: Flags [.], cksum 0x19d5 (incorrect -> 0xb32f), seq 121633:123081, ack 179, win 30, options [nop,nop,TS val 3046261955 ecr 886028448], length 1448
1550703442.910651 IP (tos 0x0, ttl 64, id 26620, offset 0, flags [DF], proto TCP (6), length 64)
    10.0.0.5.53968 > 10.0.0.2.8000: Flags [.], cksum 0x1439 (incorrect -> 0xe961), ack 123081, win 180, options [nop,nop,TS val 886028502 ecr 3046261955,nop,nop,sack 1 {156385:157833}], length 0
1550703442.917240 IP (tos 0x0, ttl 64, id 49309, offset 0, flags [DF], proto TCP (6), length 1500)
    10.0.0.2.8000 > 10.0.0.5.53968: Flags [.], cksum 0x19d5 (incorrect -> 0xea00), seq 123081:124529, ack 179, win 30, options [nop,nop,TS val 3046261961 ecr 886028453], length 1448
1550703442.918843 IP (tos 0x0, ttl 64, id 26621, offset 0, flags [DF], proto TCP (6), length 64)
    10.0.0.5.53968 > 10.0.0.2.8000: Flags [.], cksum 0x1439 (incorrect -> 0xe3ab), ack 124529, win 180, options [nop,nop,TS val 886028510 ecr 3046261961,nop,nop,sack 1 {156385:157833}], length 0
1550703442.920889 IP (tos 0x0, ttl 64, id 49310, offset 0, flags [DF], proto TCP (6), length 1500)
    10.0.0.2.8000 > 10.0.0.5.53968: Flags [.], cksum 0x19d5 (incorrect -> 0x1b82), seq 124529:125977, ack 179, win 30, options [nop,nop,TS val 3046261961 ecr 886028453], length 1448
1550703442.922619 IP (tos 0x0, ttl 64, id 26622, offset 0, flags [DF], proto TCP (6), length 64)
    10.0.0.5.53968 > 10.0.0.2.8000: Flags [.], cksum 0x1439 (incorrect -> 0xddff), ack 125977, win 180, options [nop,nop,TS val 886028514 ecr 3046261961,nop,nop,sack 1 {156385:157833}], length 0
1550703442.927201 IP (tos 0x0, ttl 64, id 49311, offset 0, flags [DF], proto TCP (6), length 1500)
    10.0.0.2.8000 > 10.0.0.5.53968: Flags [.], cksum 0x19d5 (incorrect -> 0x653c), seq 125977:127425, ack 179, win 30, options [nop,nop,TS val 3046261967 ecr 886028459], length 1448
1550703442.929083 IP (tos 0x0, ttl 64, id 26623, offset 0, flags [DF], proto TCP (6), length 64)
    10.0.0.5.53968 > 10.0.0.2.8000: Flags [.], cksum 0x1439 (incorrect -> 0xd84b), ack 127425, win 180, options [nop,nop,TS val 886028520 ecr 3046261967,nop,nop,sack 1 {156385:157833}], length 0
1550703442.932920 IP (tos 0x0, ttl 64, id 49312, offset 0, flags [DF], proto TCP (6), length 1500)
    10.0.0.2.8000 > 10.0.0.5.53968: Flags [.], cksum 0x19d5 (incorrect -> 0xb083), seq 127425:128873, ack 179, win 30, options [nop,nop,TS val 3046261967 ecr 886028459], length 1448
1550703442.934851 IP (tos 0x0, ttl 64, id 26624, offset 0, flags [DF], proto TCP (6), length 64)
    10.0.0.5.53968 > 10.0.0.2.8000: Flags [.], cksum 0x1439 (incorrect -> 0xd29d), ack 128873, win 180, options [nop,nop,TS val 886028526 ecr 3046261967,nop,nop,sack 1 {156385:157833}], length 0
1550703442.940388 IP (tos 0x0, ttl 64, id 49313, offset 0, flags [DF], proto TCP (6), length 1500)
    10.0.0.2.8000 > 10.0.0.5.53968: Flags [.], cksum 0x19d5 (incorrect -> 0x296c), seq 128873:130321, ack 179, win 30, options [nop,nop,TS val 3046261980 ecr 886028466], length 1448
1550703442.941702 IP (tos 0x0, ttl 64, id 26625, offset 0, flags [DF], proto TCP (6), length 64)
    10.0.0.5.53968 > 10.0.0.2.8000: Flags [.], cksum 0x1439 (incorrect -> 0xcce1), ack 130321, win 180, options [nop,nop,TS val 886028533 ecr 3046261980,nop,nop,sack 1 {156385:157833}], length 0
1550703442.945405 IP (tos 0x0, ttl 64, id 49314, offset 0, flags [DF], proto TCP (6), length 1500)
    10.0.0.2.8000 > 10.0.0.5.53968: Flags [.], cksum 0x19d5 (incorrect -> 0xd610), seq 130321:131769, ack 179, win 30, options [nop,nop,TS val 3046261980 ecr 886028466], length 1448
1550703442.946962 IP (tos 0x0, ttl 64, id 26626, offset 0, flags [DF], proto TCP (6), length 64)
    10.0.0.5.53968 > 10.0.0.2.8000: Flags [.], cksum 0x1439 (incorrect -> 0xc735), ack 131769, win 179, options [nop,nop,TS val 886028538 ecr 3046261980,nop,nop,sack 1 {156385:157833}], length 0
1550703442.959856 IP (tos 0x0, ttl 64, id 49315, offset 0, flags [DF], proto TCP (6), length 1500)
